UI_ID,Caption,Character Count,Comments Count,Likes Count,Total Actions,Media Type,Includes Hashtag
CompanyJ_3789,Minshew + Chark =  Time to go all in on the Jags passing attack,63,160,38631,38791,video,FALSE
CompanyJ_3790,@patbev21s journey is unlike any other    Slept in a car with his mom  Grew up without a father  Cousin shot dead at 16  Scouts said he was too small  Had to leave college to play in Europe  Now has $40M contract and a real shot at a ring,238,3633,495930,499563,image,FALSE
CompanyJ_3791,"Who saw this coming?   February 2019: Bryce Harper leaves Washington, signs 13-year deal with Phillies  October 2019: Phillies miss playoffs finishing 4th place in NL East, Nationals advance to first ever NLCS",209,1918,187427,189345,carousel,FALSE
CompanyJ_3792,"Whether training for an 82 game season or preparing for battle, nutrition is key  In partnership with @todaysmilitary X B/R",123,112,24792,24904,video,FALSE
CompanyJ_3793,"This Dodgers fan was so fed up  (via @_thehoopgod, @saljmenez) NSFW",67,5523,301817,307340,video,FALSE
CompanyJ_3794,"NFL vets fed up with Baker?According to @brgridirons Mike Freeman, a lot of players in the league think Baker is too cocky and acts like a better player than he is.  One defensive player with a ring said He acts like hes won 10 Super Bowls. He hasnt won any.",258,11779,459065,470844,image,FALSE
CompanyJ_3795,Raiders safety @thejabram is still getting roasted for how he pronounces salmon   Hard Knocks: Training Camp with the Oakland Raiders is Streaming on HBO,153,338,36586,36924,video,FALSE
CompanyJ_3796,TB12 passes Peyton Manning for second on the NFLs all-time passing list @brgridiron,83,1125,152330,153455,image,FALSE
CompanyJ_3797,Giants defense SWARMED Brady and Markus Golden gave it his all for this TD  @brgridiron (via @nfl),98,987,190350,191337,video,FALSE
CompanyJ_3798,Mystics win their first WNBA title!   Emma Meesseman named Finals MVP  @wearejayla,82,1733,119279,121012,carousel,FALSE
CompanyJ_3799,Elena Delle Donne battled through this season and came out with her first Title  -Herniated disk -Broken Nose -Bone bruise in knee  The WNBA MVP was also the first player to go 50/40/90 @wearejayla,197,1896,176368,178264,image,FALSE
CompanyJ_3800,"Houston Astros advance to 3rd straight ALCS  Astros handle Rays, 6-1 in Game 5",78,482,105535,106017,carousel,FALSE
CompanyJ_3801,Kawhis first 3-pointer on Clippers was too smooth ,50,1898,261813,263711,video,FALSE
CompanyJ_3802,Daniel Jones throws 3 INTs against the Patriots in 35-14 defeat @brgridiron,75,4625,358237,362862,image,FALSE
CompanyJ_3803,Cant guard Steph when he does this ,35,1475,259074,260549,video,FALSE
CompanyJ_3804,@45pedromartinez staked his claim as one of the GOATs 20 years ago ,67,346,97992,98338,carousel,FALSE
CompanyJ_3805,Bronny x Zaire  Just like their dads @br_hoops,46,5669,891512,897181,carousel,FALSE
CompanyJ_3806,This animator takes every LeBron post on social and recreates a giraffe version on @leraffejames ,97,1587,199198,200785,video,FALSE
CompanyJ_3807,#NAME?,54,202,30153,30355,video,FALSE
CompanyJ_3808, @brkicks @travisscott,22,706,110160,110866,video,FALSE
CompanyJ_3809,One of the best rivalries in sports: Oklahoma vs. Texas. Who ya got?,68,452,51375,51827,video,FALSE
CompanyJ_3810,Lonzo knows his little brothers real potential ,47,2021,361021,363042,carousel,FALSE
CompanyJ_3811,That father-son connection  @br_hoops,37,523,171233,171756,video,FALSE
CompanyJ_3812,ZION FROM LONG RANGE ,21,3637,372536,376173,video,FALSE
CompanyJ_3813,Jalen Hurts and Sam Ehlinger have been making plays for their team all season.  Can the Longhorns knock off the Sooners in their Red River showdown? ( @wendys),159,250,84262,84512,carousel,FALSE
CompanyJ_3814,RJ showing out in his first game at MSG ,40,1218,237794,239012,video,FALSE
CompanyJ_3815,"Ryan Zimmerman went SUPERMAN   Nationals win NLCS Game 1, 2-0.",62,834,158966,159800,video,FALSE
CompanyJ_3816,#NAME?,90,2265,328652,330917,carousel,FALSE
CompanyJ_3817,Red River Rivalry got off to a hot start  *NSFW* (via @eddie_rado),66,3279,333293,336572,video,FALSE
CompanyJ_3818,Headband. Chalk toss. Vintage @kingjames is back  (via @lakers),63,1660,283003,284663,video,FALSE
CompanyJ_3819,Death Valley at night. Tigers-Gators. Buckle up ,48,305,79533,79838,video,FALSE
CompanyJ_3820,CeeDee Lamb DESTROYED the Texas defense and led Oklahoma to a win in the Red River Rivalry ,91,1336,296433,297769,carousel,FALSE
CompanyJ_3821,"South Carolina upset No. 3 Georgia in Athens, and no one was happier than QB Ryan Hilinski, who honors his late brother Tyler by wearing the No. 3 jersey ",154,511,229995,230506,carousel,FALSE
CompanyJ_3822,This Bama fan needs a refund ,29,1716,372229,373945,video,FALSE
CompanyJ_3823,CeeDee Lamb left the Texas defense frozen  @exxonmobil,54,322,92736,93058,video,FALSE
CompanyJ_3824,Last Chance U alum Malik Henry out here throwing DIMES for Nevada ,66,4027,546147,550174,carousel,FALSE
CompanyJ_3825,CJ actually hit the one-legged three ,37,1114,242859,243973,video,FALSE
CompanyJ_3826,Jayden Daniels was cold blooded on this game game-winning TD run  (From BR x @coorslight),89,211,70349,70560,video,FALSE
CompanyJ_3827,Coco Gauff has won her first @wta title at 15 years old.  Shes the youngest American woman to win a tour singles title since 1991 after defeating Jelena Ostapenko in the Linz Open. Venus and Serena were 17 for their first singles titles.,237,464,127862,128326,carousel,FALSE
CompanyJ_3828, status.,8,823,176945,177768,image,FALSE
CompanyJ_3829,"Tyreek is back  5'10"" receiver MOSSED the Texans for a ridiculous touchdown in his first game since Week 1 @brgridiron",118,671,185664,186335,carousel,FALSE
CompanyJ_3830,Lamar joined Vick and Kap as the only QBs in the Super Bowl era to run for 150 yards in a game  @brgridiron,107,1195,210809,212004,carousel,FALSE
CompanyJ_3831,Broadway Sam gets the Jets their first win of the season  @brgridiron,69,1701,230548,232249,image,FALSE
CompanyJ_3832,Zion's last three preseason games have been near-perfect performances  22 PTS (8-11FG) 26 PTS (9-12FG) 29 PTS (12-13FG)  He's shooting 80.5% ,141,4834,481088,485922,carousel,FALSE
CompanyJ_3833,CARLOS CORREA CALLED GAME   Correa hits walk-off home run to beat Yankees in 11th inning to even ALCS 1-1,105,1042,184470,185512,carousel,FALSE
CompanyJ_3834,Talk that talk  @simonebiles (h/t @wearejayla),46,2088,235377,237465,image,FALSE
CompanyJ_3835,Cowboys fans waking up and realizing Jason Garrett hasnt been fired (@brgridiron),81,4561,280450,285011,video,FALSE
CompanyJ_3836,"49ers defense is a FORCE this year, and it has DC Robert Saleh going wild on the sidelines  @brgridiron  --- ( @thecheckdown)",125,1843,256711,258554,carousel,FALSE
CompanyJ_3837,CR700 - @cristiano becomes the 6th player in history to reach 700 career goals   @brfootball,92,611,99675,100286,carousel,FALSE
CompanyJ_3838,"LB Zach Brown called Kirk Cousins the ""weakest part"" of the Vikings offense three days ago.  Cousins threw for 333 yards and 4 TDs in a win against Philadelphia on Sunday.  Eagles released Brown today @brgridiron",212,5117,369335,374452,carousel,FALSE
CompanyJ_3839,Can you figure out whats different between the first and second video? ,71,12190,218480,230670,carousel,FALSE
CompanyJ_3840,"TYLER HERRO IS A FLAMETHROWER   Scored the first 14 points for the Heat, while hitting four-straight threes.",108,2507,394855,397362,carousel,FALSE
CompanyJ_3841,RODGERS DROPPED THAT IN  (via @nfl),35,1945,178024,179969,video,FALSE
CompanyJ_3842,Aaron Rodgers comes back to get it done.  Packers win 23-22 at Lambeau. @brgridiron,83,5064,239730,244794,video,FALSE
CompanyJ_3843,Zach Norvell Jr. had Jordan Poole on all fours and the Lakers bench went WILD ,78,1633,208341,209974,video,FALSE
CompanyJ_3844,It's been a long road to success for Last Chance U's Malik Henry ,65,445,105461,105906,video,FALSE
CompanyJ_3845,Bron clarified his comments on Daryl Morey/Hong Kong.,53,4126,213698,217824,carousel,FALSE
CompanyJ_3846,ONE. WEEK.,10,1726,350491,352217,image,FALSE
CompanyJ_3847,"Breaking: Rams have traded CB Marcus Peters to the Ravens, per @rapsheet  @brgridiron",85,3505,314141,317646,image,FALSE
CompanyJ_3848,The RB committee tries to figure out how to get paid like WRs  #GridironHeights,79,879,104317,105196,video,TRUE
CompanyJ_3849,"Breaking: Jalen Ramsey is headed to the Rams for two first-round picks and a fourth-round pick, per @adamschefter",113,7818,532455,540273,image,FALSE
CompanyJ_3850,Los Angeles is the city of stars  @brgridiron,45,4641,407991,412632,carousel,FALSE
CompanyJ_3851,New CB1  @jalenramsey  @brgridiron,34,967,221085,222052,image,FALSE
CompanyJ_3852," NATIONALS ARE GOING TO THE WORLD SERIES   Sweep the Cardinals, 4-0  Punch ticket to first WS in franchise history  Celebrate with champagne",140,1908,213206,215114,carousel,FALSE
CompanyJ_3853,"Russ leads the NFL in touchdowns, passer rating and game-winning drives. MVP?  @brgridiron",90,2702,291504,294206,carousel,FALSE
CompanyJ_3854,Jordan Clarkson pulled up on a scooter and posed for these newlywed photos in a Cleveland park  @benjaminscott714 | @lisalmacphoto,130,1227,238297,239524,carousel,FALSE
CompanyJ_3855, @brkicks,9,2694,146459,149153,image,FALSE
CompanyJ_3856,"@sergeibakas cooking show How Hungry Are You? is coming to B/R starting Mon., 10/21",83,375,34267,34642,video,FALSE
CompanyJ_3857,Myles Garrett says he got sucker punched by a fan  @brgridiron,62,2271,363935,366206,carousel,FALSE
CompanyJ_3858,KD is the  of Twitter beef and he proved it this offseason.,59,649,61821,62470,video,FALSE
CompanyJ_3859,Dejounte Murray locked up Harden and then scored on him ,56,8291,503933,512224,video,FALSE
CompanyJ_3860,Vinsanity had MSG on their feet ,32,1535,291648,293183,carousel,FALSE
CompanyJ_3861,LeBron and AD showed out at Staples Center vs. the Warriors  Swipe ,67,4149,495919,500068,carousel,FALSE
CompanyJ_3862,"Wizards and Bradley Beal agree to 2-year, $72M max extension, per @wojespn",74,1858,247421,249279,image,FALSE
CompanyJ_3863,@miketyson still got it at 53 years old ,40,2498,175748,178246,video,FALSE
CompanyJ_3864,"ANKLES @brianna_alger  (via @shoffman_14, @wsucougarsoccer)",59,6974,450332,457306,video,FALSE
CompanyJ_3865,Buddy wants his money ,22,11778,395754,407532,image,FALSE
CompanyJ_3866,Brons no-look pass from courtside (via @pablo024),49,1346,230531,231877,video,FALSE
CompanyJ_3867,GMs weigh in on the upcoming season ,36,1387,187666,189053,carousel,FALSE
CompanyJ_3868,Adam Silver didnt think twice.,30,4048,327062,331110,image,FALSE
CompanyJ_3869,Odell the modern Prime Time?  OBJ says hed consider pulling a @DeionSanders and play a second pro sport if there was ever an NFL lockout @brgridiron  - - - (via Pat McManamon of @theathletichq),193,3060,294080,297140,carousel,FALSE
CompanyJ_3870,"New season, new looks ",22,697,160882,161579,carousel,FALSE
CompanyJ_3871,Patrick Mahomes has been ruled out for rest of game vs. Broncos after suffering a knee injury.  Hope hes ok  @brgridiron,120,3279,289238,292517,carousel,FALSE
CompanyJ_3872,Mahomes says hell be ok  @brgridiron,36,1057,231086,232143,image,FALSE
CompanyJ_3873,Luka put the moves on Kawhi ,28,6427,372963,379390,video,FALSE
CompanyJ_3874,CC Sabathia walked off the mound to a Yankees fans standing ovation in Game 4 after experiencing discomfort ,108,829,201284,202113,carousel,FALSE
CompanyJ_3875,"Zion Williamson expected to miss a couple weeks to start the season due to knee injury, no shortage of confidence he will be fully recovered, per @wojespn",154,3783,345147,348930,image,FALSE
CompanyJ_3876,Knee injuries cant hold back this type of talent forever... Get well soon ,74,2835,512260,515095,image,FALSE
CompanyJ_3877,"This Twitch streamer was so in awe of 20K viewers, he woke up his mom to come and see it @brgaming (via @nicewigg)",114,1438,123329,124767,video,FALSE
CompanyJ_3878,"Larry Fitz had to school the rook on Julios greatness. ""11, dogYoure gonna see some s--t today"" @brgridiron (via @nflfilms)",123,1308,226843,228151,video,FALSE
CompanyJ_3879,"The NBA title will go through L.A., but it won't be for the Lakers... it will be the Clippers according to @howardabeck ",120,3306,158312,161618,video,FALSE
CompanyJ_3880,Elite guests eating nasty food   @easymoneysniper is on the premiere of How Hungry Are You? dropping Mondayand hes eating snake ,128,267,61198,61465,video,FALSE
CompanyJ_3881,"@shaq found a home for the family of a 12-year-old boy who was paralyzed in a shooting and will pay a year's rent for them, per @11alive",136,1947,344747,346694,image,FALSE
CompanyJ_3882,Kyrie gets his first bucket as a Net ,37,1732,254253,255985,video,FALSE
CompanyJ_3883,Lonzo left it short ,20,2737,231568,234305,video,FALSE
CompanyJ_3884,RJ put on a show at MSG with 17 first half points and an EMPHATIC dunk ,71,644,162180,162824,video,FALSE
CompanyJ_3885,Norvell drops Poole...again?!,29,1453,169520,170973,video,FALSE
CompanyJ_3886,Kendrick Nunn went undrafted in 2018  Tonight he dropped 40 points for the Heat ,80,2030,261762,263792,video,FALSE
CompanyJ_3887,Ronaldo really makes more money on Instagram than on the field  @brfootball,75,1175,211633,212808,image,FALSE
CompanyJ_3888,Hes only 4 years old and hes throwing gas  (via @hectorgomezmlb),64,3262,258275,261537,video,FALSE
CompanyJ_3889,"Pascal Siakam has agreed to a 4-year max contract extension with Raptors, per @wojespn & Zach Lowe",98,2180,293163,295343,image,FALSE
CompanyJ_3890,CR700.  What a flex. @brfootball,32,398,130570,130968,image,FALSE
CompanyJ_3891,Gus Johnson with the play call of the year on the Sooner Schooner collapsing ,77,9905,588018,597923,video,FALSE
CompanyJ_3892,Illinois really played Jump Around after upsetting No. 6 Wisconsin  (via @johnboelwave3),88,1244,284327,285571,carousel,FALSE
CompanyJ_3893,This Astros fan had to be escorted from his seat after getting beer and popcorn thrown in his face while he threw up 3-1 signs (via @mhjay_),140,9445,392768,402213,video,FALSE
CompanyJ_3894,The Crimson Tide are undefeated and their WR core is a big reason why ,70,628,79809,80437,video,FALSE
CompanyJ_3895, TCUs QB went BEAST MODE ,25,956,166022,166978,video,FALSE
CompanyJ_3896,Four-time cancer survivor Casey O'Brien got his first hold for the Gophers. Words can't do these type of moments justice. ,122,1082,284362,285444,video,FALSE
CompanyJ_3897,#NAME?,34,5998,360997,366995,image,FALSE
CompanyJ_3898,Michigan fans losing to a top-10 opponent yet again:,52,677,70450,71127,video,FALSE
CompanyJ_3899,Astros move on to the World Series for the second time in three years!  Ice cold in their biggest moment of the postseason   From B/R X @coorslight,147,767,62056,62823,video,FALSE
CompanyJ_3900,Altuve ripped the heart out of Yankees fans,43,1503,223812,225315,carousel,FALSE
CompanyJ_3901,ALTUVE. LEFT. NO. DOUBT. (via @napogh),38,915,157918,158833,video,FALSE
CompanyJ_3902,Behind the back. Through the legs. WHAT.  ( @Ballislife | @isaiahrivera1),73,4908,425912,430820,video,FALSE
CompanyJ_3903,FedEx Field is a slip 'n slide today @brgridiron  (via @thecheckdown),69,733,147344,148077,video,FALSE
CompanyJ_3904,Ramsey and Julio battling all day  @brgridiron   ( @nfl),56,1093,237344,238437,carousel,FALSE
CompanyJ_3905,Darius Leonard with the game-winning pick and BRUTAL stiff arm  @brgridiron  (via @NFL),87,618,110525,111143,video,FALSE
CompanyJ_3906,Rodgers tossed six TDs today and the Packers moved to 6-1  @brgridiron,70,2436,274269,276705,video,FALSE
CompanyJ_3907,Lamar wanted to go for it on fourth down. Lamar got it. Lamar scored  @brgridiron (via @thecheckdown),101,526,109363,109889,video,FALSE
CompanyJ_3908,Amari's route running is ridiculous  @brgridiron (via @thecheckdown),68,1929,229205,231134,video,FALSE
CompanyJ_3909,#NAME?,61,1592,294999,296591,video,FALSE
CompanyJ_3910,Zeke was eating all night  @brgridiron  147 yards TD W,54,1436,222922,224358,image,FALSE
CompanyJ_3911,Dak makes history in Dallas  (@campbells) #ad,45,513,68592,69105,video,TRUE
CompanyJ_3912,Niners WR Dante Pettis pulled up to go sailgating and started passing food to other boats  ( @wendys),101,165,32653,32818,video,FALSE
CompanyJ_3913,What we want to see in the East this season:,44,8096,642902,650998,carousel,FALSE
CompanyJ_3914,"2009  2019. The 09 draft class, 10 years later ",47,2099,494772,496871,carousel,FALSE
CompanyJ_3915,BASKETBALL IS BACK  B/R NBA writers predict the season ,55,1366,139793,141159,carousel,FALSE
CompanyJ_3916,Imagine this in the West ,25,4275,594212,598487,carousel,FALSE
CompanyJ_3917,Breaking: Zion Williamson out for 6-8 weeks after successful surgery for a torn lateral meniscus in his right knee,114,9904,495473,505377,image,FALSE
CompanyJ_3918,KD was confident if the Finals went 7 ,38,6884,499227,506111,carousel,FALSE
CompanyJ_3919,Tomorrow is STACKED ,20,1800,232394,234194,image,FALSE
CompanyJ_3920,"Over the summer, a young Chiefs fan with a brain tumor gave Patrick Mahomes a bracelet with her name on it (Whitney Wells). Hes been wearing it all season @brgridiron    (via @chiefslotjtailgatecrew | @nfldraftscout)",216,947,335841,336788,image,FALSE
CompanyJ_3921,Patriots forced Darnold into FIVE turnovers and moved to 7-0  @brgridiron,73,2232,242676,244908,carousel,FALSE
CompanyJ_3922,"The undefeated Patriots are trading a second-round pick for Falcons WR Mohamed Sanu, per @adamschefter  @brgridiron",115,5188,449281,454469,image,FALSE
CompanyJ_3923,Are you ready?,14,2658,104970,107628,video,FALSE
CompanyJ_3924,Hmm ,4,20405,435408,455813,image,FALSE
CompanyJ_3925,Timed the spare perfectly  (via @zachjbacon2),45,1914,275595,277509,video,FALSE
CompanyJ_3926,The NBA landscape has shifted to dynamic duos.,46,605,81287,81892,video,FALSE
CompanyJ_3927,"Belichick is an evil genius  In the 4th quarter last night, he had the Patriots commit back-to-back penalties on purpose. Jets declined both, and the clock kept running for over a minute. Belichick held back laughter on the sideline.  He said the loophole should be closed but right now, its open  @brgridiron",309,2687,447005,449692,carousel,FALSE
CompanyJ_3928,"Niners are trading for Emmanuel Sanders, per Mike Klis of @9newsdenver  Undefeated SF going all in @brgridiron",110,1317,216785,218102,image,FALSE
CompanyJ_3929,B/Rs Top 10 NBA players in 2019-20 ,35,3358,88773,92131,carousel,FALSE
CompanyJ_3930,The run. The finish. Raheem Sterling cut the defense open ,58,202,42518,42720,video,FALSE
CompanyJ_3931,Bradys former backups are balling...and Tom is freaking out  #GridironHeights,77,627,89598,90225,video,TRUE
CompanyJ_3932,The battle of LA begins tonight ,32,497,64654,65151,video,FALSE
CompanyJ_3933,Almost half the league  @brgridiron,35,2051,222372,224423,image,FALSE
CompanyJ_3934,THE NBA IS HERE...but Zion isnt ,32,5600,367084,372684,video,FALSE
CompanyJ_3935,"Welcome to the family, @dwyanewade ",35,225,70478,70703,video,FALSE
CompanyJ_3936,Every Raptors fan in attendance is gonna walk away with this replica championship ring  (via @lloydjulian),106,1647,257731,259378,video,FALSE
CompanyJ_3937,Raptors got their first championship banner ,44,2056,365318,367374,carousel,FALSE
CompanyJ_3938,Custom championship rings for @champagnepapi ,45,1825,333186,335011,carousel,FALSE
CompanyJ_3939,This Lonzo pass was filthy ,27,2823,382481,385304,video,FALSE
CompanyJ_3940,Bron fadeaway on Kawhi was tough ,33,5173,630941,636114,video,FALSE
CompanyJ_3941,Bron got MVP chants and Kawhi got booed. Staples Center is about to be appointment TV this year ,96,2499,299162,301661,video,FALSE
CompanyJ_3942,Kawhi and Bron trading buckets in the Battle of LA ,51,759,187802,188561,video,FALSE
CompanyJ_3943,LEBRON IS FED UP. STAREDOWN AFTER THE ,38,2465,230945,233410,video,FALSE
CompanyJ_3944,Its a new day in LA ,20,6177,328061,334238,video,FALSE
CompanyJ_3945,30 PTS | 6 REB | 5 AST,22,2990,255638,258628,video,FALSE
CompanyJ_3946,"Josh Normans crib has everything...giraffe rug, vibrating bed, personal barbershop, life-sized Batman painting. New Ditch the Playbook with @AdamLefkoe (@statefarm)",164,768,174283,175051,video,FALSE
CompanyJ_3947,This Raptors fan really got Commissioner Silver to present him with his replica ring  (via @k_jiwani),101,1738,369648,371386,video,FALSE
CompanyJ_3948,Nothing was going to stop this reporter  (via @matchtv_channel),63,834,107145,107979,video,FALSE
CompanyJ_3949,THIS GOAL. WOW.  (via @brfootball),34,1122,100643,101765,video,FALSE
CompanyJ_3950,"Kawhi may have been booed by Lakers fans during his home debut as a Clipper, but the Finals MVP stole the show at Staples ",122,518,89038,89556,video,FALSE
CompanyJ_3951,The silent superstar is speaking up  Julio Jones delivered an emotional locker room speech after the Falcons fifth straight loss supporting coach Dan Quinn: This man has done everything for us. ... Its on us. @brgridiron - - - (via @zachkleinwsb),246,2493,496453,498946,image,FALSE
CompanyJ_3952,"Patrick Beverley criticized TV programs that routinely show highlights of [LeBron] in defeats"" and challenged the media to ""report the facts"" after Lakers-Clippers on opening night  (via @chrisbhaynesnba)",204,10516,580539,591055,image,FALSE
CompanyJ_3953,"Patriots WR Josh Gordon is out for the year with a knee injury, per @FieldYates.   Flashs time in New England is likely over, too, and hell be waived once healthy, according to @rapsheet.",187,3265,305493,308758,image,FALSE
CompanyJ_3954,New era begins in Brooklyn tonight ,35,3517,340295,343812,image,FALSE
CompanyJ_3955,Kyrie and KD officially introduced in Brooklyn for the first time ,66,5123,537998,543121,carousel,FALSE
CompanyJ_3956,DJJ JUST THREW IT IN ,21,2571,324669,327240,video,FALSE
CompanyJ_3957,MARKELLE FULTZ DUNK IN TRANSITION,33,4784,449396,454180,video,FALSE
CompanyJ_3958,Cody Rhodes punched through the glass and threw Chris Jericho on the Dippin Dots cart  @brwrestling,99,5013,329313,334326,video,FALSE
CompanyJ_3959,"Despite the loss, Kyrie had an unforgettable Nets debut   50 PTS (most points ever in Nets debut) 8 REB 7 AST",109,3714,464827,468541,carousel,FALSE
CompanyJ_3960,The Joker and Nuggets open the season with a win over Portland ,63,1294,309554,310848,image,FALSE
CompanyJ_3961,DAME DOLLA. OPENING NIGHT. ,27,695,111050,111745,video,FALSE
CompanyJ_3962,Derrick Jones Jr. caught a BODY ,32,777,157822,158599,video,FALSE
CompanyJ_3963,LAMELO WITH THE GROWN MAN PUTBACK  (via @nbl) @br_hoops,55,1382,172117,173499,video,FALSE
CompanyJ_3964,If Kyrie hit a game-winner with an NBA Street move in his Brooklyn debut...,75,8268,554791,563059,video,FALSE
CompanyJ_3965,This Russ/Lockett elevator is genius  @brgridiron   (via @rudy_willingham),74,2166,278817,280983,video,FALSE
CompanyJ_3966,Happy birthday to the sideline champion @champagnepapi,54,1948,486768,488716,carousel,FALSE
CompanyJ_3967,"7'6"" Tacko Fall says a ""low ceiling"" was the reason he was in concussion protocol, per John Karalis",99,2079,369413,371492,image,FALSE
CompanyJ_3968,"Eight years ago, Adrian Peterson tore his ACL vs. the Redskins. He was ready for the start of the Vikings 2012 season nine months later. Unreal recovery  @brgridiron   His 2012 season:  MVP  2,097 yards  131.1 YPG  13 TDs  Eight yards from Eric Dickersons rushing record",270,1565,366535,368100,image,FALSE
CompanyJ_3969,This rally is wild  @brfootball (via @andersonaguia),52,2602,286273,288875,video,FALSE
CompanyJ_3970,Yesterday was one year after Kyrie's grandfather's death.  Dropped 50 for him ,78,918,300658,301576,image,FALSE
CompanyJ_3971,The artist who did it sucked!  @jno24 isnt a fan of the life-sized Batman painting in his house,95,263,58321,58584,video,FALSE
CompanyJ_3972,From OKC to H-town  Russ makes his Rockets debut tonight ,57,457,133935,134392,video,FALSE
CompanyJ_3973,"A man wielding a baseball bat tried to break into Fletcher Coxs New Jersey home earlier this month looking for his ex-girlfriend, but the Eagles tackle scared him off with a shotgun.  Cops pursued and eventually arrested the man. (via @6abcactionnews | @brgridiron)",265,4458,397280,401738,image,FALSE
CompanyJ_3974,#NAME?,48,452,102694,103146,video,FALSE
CompanyJ_3975,Vince checks in.  22 seasons. History made ,43,2688,444464,447152,carousel,FALSE
CompanyJ_3976,Russ got his old dance partner back  (via @nbaontnt),52,1805,382331,384136,video,FALSE
CompanyJ_3977,Russ and Harden already going back and forth ,45,8129,595244,603373,video,FALSE
CompanyJ_3978,NBA suspends Deandre Ayton 25 games for testing positive for a diuretic,71,5477,427063,432540,image,FALSE
CompanyJ_3979,Ice Trae looking to make the leap  38 PTS | 9 AST | 7 REB,57,1665,301085,302750,carousel,FALSE
CompanyJ_3980,GIANNIS CHASES DOWN HARDEN ,27,2448,332450,334898,video,FALSE
CompanyJ_3981, Beard to Brodie ,17,1056,167819,168875,video,FALSE
CompanyJ_3982,Loading...  DLo scores the first 10 PTS for the Warriors,56,1117,229088,230205,video,FALSE
CompanyJ_3983,Kawhi ,6,2057,264465,266522,video,FALSE
CompanyJ_3984,The connection would be unreal... @brgridiron,45,2664,345423,348087,image,FALSE
CompanyJ_3985,"People in the NFL think @jno24 is weird, but hes cool with it.",62,152,30187,30339,video,FALSE
CompanyJ_3986,"If the Chiefs star QB doesnt play this weekend, Kansas City could be in serious trouble...",90,273,49875,50148,video,FALSE
CompanyJ_3987,#NAME?,173,275,71700,71975,video,FALSE
CompanyJ_3988,He got them fired up before a big game   From @Ford X B/R #PFHOF,64,194,51703,51897,video,FALSE
CompanyJ_3989,He was having too much fun  @brfootball,39,750,118645,119395,video,FALSE
CompanyJ_3990,Juan Sotos come-up is bigger than baseball  Finished English program at Nationals Academy in one season  Refused to speak Spanish with teammates: Only English  Ordered off McDonalds menu for practice,199,608,181151,181759,carousel,FALSE
CompanyJ_3991,Kyrie vs. RJ. Knicks vs. Nets.  Battle of the boroughs goes down tonight at Barclays ,85,381,80625,81006,video,FALSE
