UI_ID,Caption,Character Count,Comments Count,Likes Count,Total Actions,Media Type,Includes Hashtag
CompanyJ_1,The New Years Party we want to see ,35,1340,198986,200326,video,FALSE
CompanyJ_2,"James Harden joins Kobe and MJ as 3rd player in last 30 years to drop 400 points in 10-game span, per Elias Sports Bureau",121,5240,447820,453060,image,FALSE
CompanyJ_3,Harden is in MVP form ,22,1880,278107,279987,image,FALSE
CompanyJ_4,Russ wishes everyone a Happy New Year and gives away his shoes to a lucky fan on the way out  (@brkicks),104,694,261846,262540,video,FALSE
CompanyJ_5,Jimmy Butler made his NBA debut on this day in 2012. His road to get there was incredible.  No. 73 SG in Texas  No D-I offers  Went to JuCo  Faxed acceptance to Marquette from McDonalds  Had no idea he was an NBA prospect,221,2223,536990,539213,image,FALSE
CompanyJ_6,KD showed this fan so much love  (via @jordanpruneau),53,2135,292894,295029,video,FALSE
CompanyJ_7,40.8 PPG over his last 10 games ,32,3348,295651,298999,image,FALSE
CompanyJ_8,The Bears remixed the Super Bowl Shuffle for 2019 #GridironHeights,66,1104,95838,96942,video,FALSE
CompanyJ_9,UCF finally loses ,18,2795,212893,215688,image,FALSE
CompanyJ_10,Dwayne Haskins and the Buckeyes win the Rose Bowl 28-23! ,57,845,183928,184773,image,FALSE
CompanyJ_11,GIANNIS ,8,5243,474809,480052,video,FALSE
CompanyJ_12,Kawhi dropped a career-high 45 points on the Jazz ,50,1277,191878,193155,video,FALSE
CompanyJ_13,Giannis dunked Jon Leuer back to 2018 ,38,478,103245,103723,video,FALSE
CompanyJ_14,"Tyler Trent, former Purdue student and Boilermakers superfan, has died at 20 years old. Tyler was an inspiration to all. This is his story ",139,561,110031,110592,video,FALSE
CompanyJ_15,Kobe and Vanessa announce theyre expecting their 4th baby girl ,63,9458,491949,501407,image,FALSE
CompanyJ_16,Whyd Plumlee do his own teammate like that? ,44,4397,329328,333725,video,FALSE
CompanyJ_17,"Things are getting chippy in LA. First Pat Bev and Embiid get into it, then Jimmy and Avery Bradley both get ejected ",117,2319,336930,339249,video,FALSE
CompanyJ_18,This Ben Simmons inbounds play ,31,7664,661020,668684,video,FALSE
CompanyJ_19,Chelsea signs Christian Pulisic from Dortmund for $73 million . The USMNT star will remain with BVB until this summer then join his new team (@brfootball),154,1528,176414,177942,image,FALSE
CompanyJ_20,Legendary 5x5 for Nurkic.,25,2814,411995,414809,image,FALSE
CompanyJ_21,"Raheem Sterling's 1-year-old son with an absolute BOOT  (via @sterling7, @brfootball)",85,2121,254127,256248,video,FALSE
CompanyJ_22,Remember the girl who wrote to Steph Curry asking why his sneakers werent available for girls? She got a Christmas surprise from the 2x MVP  @brkicks,149,800,179767,180567,video,FALSE
CompanyJ_23,The 2x league leader in interceptions raised the bar for cornerbacks. From B/R x @ford #PFHOF19,95,170,20117,20287,video,FALSE
CompanyJ_24,"After a convincing win over the Titans, NFL analyst Shaun O'Hara gives the Colts OLOTW for Week 17",98,148,14931,15079,video,FALSE
CompanyJ_25,@chrisjohnsontwo8 thinks it was rigged when John Ross broke his 4.24 40 time: The combine was getting boring ,109,530,72280,72810,video,FALSE
CompanyJ_26,Young Dirk or Doncic?,21,5865,412983,418848,image,FALSE
CompanyJ_27,Jarvis Landrys recruiting efforts havent gone unnoticed...,58,3408,308449,311857,image,FALSE
CompanyJ_28,These answers...Terry Rozier definitely doesn't watch TV ,57,1420,141425,142845,video,FALSE
CompanyJ_29,When you see yourself on the jumbotron ,39,2482,437452,439934,video,FALSE
CompanyJ_30,Russ hit Lance with the air guitar after PG scored on him ,58,9086,532835,541921,video,FALSE
CompanyJ_31,Lonzo denies Russ   Russ went 3-20 tonight and the Thunder still won.,69,3787,271449,275236,video,FALSE
CompanyJ_32,Embiid put up 42 & 18 tonight ,30,1413,277584,278997,image,FALSE
CompanyJ_33,"Respect, @deandrehopkins ",25,1363,266487,267850,image,FALSE
CompanyJ_34,The reigning MVP is on an absolute scoring tear. Rockets vs. Warriors tonight should be good ,93,823,96468,97291,video,FALSE
CompanyJ_35,Thoughts on the first round of voting results?,46,7752,422888,430640,carousel,FALSE
CompanyJ_36,Kawhi makes his return to San Antonio tonight ,46,865,280854,281719,image,FALSE
CompanyJ_37,3x Super Bowl champion 7x Pro Bowler Does Richard Seymour deserve your 2019 Pro Football Hall of Fame vote? #PFHOF19,116,111,15804,15915,video,FALSE
CompanyJ_38,Danny Ainge chimes in.,22,9747,365422,375169,image,FALSE
CompanyJ_39,The tribute video the Spurs really want to show ,48,2519,388328,390847,image,FALSE
CompanyJ_40,Kawhi gets booed on 1st bucket and Danny Green couldn't hold back a smile,73,1440,292730,294170,video,FALSE
CompanyJ_41,DeMar is ready for the Raptors ,31,970,232360,233330,video,FALSE
CompanyJ_42,Spurs fans chant traitor while Kawhi shoots FTs ,48,2004,114356,116360,video,FALSE
CompanyJ_43,DeMar did it all against his old squad ,39,2294,417722,420016,image,FALSE
CompanyJ_44,Kawhis mom was not having it with this Spurs fan  (via David Shetler/TW) *NSFW*,79,5789,503927,509716,video,FALSE
CompanyJ_45,JAMES HARDEN FOR THE WIN.,25,6026,355045,361071,video,FALSE
CompanyJ_46,Was KD not out of bounds here? ,31,11385,378977,390362,video,FALSE
CompanyJ_47,James Harden had words for Draymond Green right after the game-winner ,70,7684,512534,520218,video,FALSE
CompanyJ_48,James Harden wants it ,22,3355,472346,475701,image,FALSE
CompanyJ_49,Pop still has respect for Kawhi.,32,2357,408837,411194,image,FALSE
CompanyJ_50,He holds the league record for career receptions and receiving yards by a TE. Is Tony Gonzalez a first ballot Hall of Famer? From B/R x @ford #PFHOF19,150,186,17481,17667,video,FALSE
CompanyJ_51,"13 years since the 2006 Rose Bowl, arguably the greatest CFB game of all time  All 3 top Heisman candidates played  Highest rated BCS game in TV history  Vince Young: 467 yards, 3 TDs/0 TOs, inc. game winner with :19 left  62 players later appear in at least 1 NFL game",269,2912,337643,340555,image,FALSE
CompanyJ_52,This angle of Hardens game-winner  (via @colinfraser),53,1976,290085,292061,video,FALSE
CompanyJ_53,Club Dub was open for business 12x this season and Chicago is hoping its not over yet ,86,1335,106054,107389,video,FALSE
CompanyJ_54,D-Rose reflects on the initial results of this years All-Star Voting.,69,2153,386003,388156,image,FALSE
CompanyJ_55,Won 9 of 10 5th in PPG Career year for Luck  This offense makes the Colts dangerous ( @hulu),92,486,38956,39442,video,FALSE
CompanyJ_56,Kuzma trying to get more calls?  (via @kuz),43,2108,269856,271964,image,FALSE
CompanyJ_57,Giannis wants to go 1-on-1 with The Great One ,46,6851,556620,563471,image,FALSE
CompanyJ_58,Dipo called game but what if LaVines shot counted ,50,2302,383623,385925,video,FALSE
CompanyJ_59,"Everyone at TD Garden wanted Dirk to hit a 3, but he fell just short ",69,2276,361906,364182,video,FALSE
CompanyJ_60,Lakers fall to 1-4 without The King ,36,5009,315671,320680,image,FALSE
CompanyJ_61,LaMelo and SPIRE brought the show to Kentucky last night  @br_hoops,67,1195,145262,146457,video,FALSE
CompanyJ_62,"Triple-Double for Kyle Anderson, 17 assists for Kris Dunn. Dont ",64,1125,203065,204190,image,FALSE
CompanyJ_63,The journey to Atlanta starts today. Who will face off on Super Bowl Sunday?  ( @turbotax),90,618,61395,62013,video,FALSE
CompanyJ_64,Texans CB Johnathan Joseph didnt like T.Y. Hilton calling NRG his second home and said the comment was for clowns. This is how Hilton showed up for their matchup  (via @colts),175,1952,210218,212170,video,FALSE
CompanyJ_65,LaVar warming up to play MJ  @br_hoops,38,9542,363632,373174,video,FALSE
CompanyJ_66,Uber driver was talking smack about the Chargers until he found out who his passenger was  (via @iammelvingordoniii),116,7895,628340,636235,carousel,FALSE
CompanyJ_67,Houstons No. 1 hypeman  (via @thecheckdown),43,3569,313004,316573,video,FALSE
CompanyJ_68,OBJ catching passes from a new QB,33,1954,171133,173087,video,FALSE
CompanyJ_69,"Fans storm into AT&T Stadium for Cowboys-Seahawks  (via @jonmachota, @thecheckdown)",83,10559,402040,412599,video,FALSE
CompanyJ_70,Luck and the Colts punch the Texans out of the playoffs!,56,1528,155012,156540,video,FALSE
CompanyJ_71," ""BEAT THE TRAFFIC!"" This Colts fan in Houston was letting everyone have it (via DEExGUILL/TW)",94,5989,432661,438650,video,FALSE
CompanyJ_72,Shoutout @brkicks for hitting 1M followers ,43,402,133649,134051,carousel,FALSE
CompanyJ_73,Luka checked in with the cameraman after a bad collision ,57,2054,400847,402901,video,FALSE
CompanyJ_74,The Bucks arena played Kawhis laugh after Raptors turnover ,59,12839,543460,556299,video,FALSE
CompanyJ_75,Zions 360 dunk had Cameron Indoor Stadium LIVE  (via @alee923),62,3873,481041,484914,video,FALSE
CompanyJ_76,Dak powers the Cowboys to a win over the Seahawks!,50,1666,121582,123248,video,FALSE
CompanyJ_77,Dak sealed the win with a BIG TIME run  (via @nfl),50,3108,178684,181792,video,FALSE
CompanyJ_78,Embiid wants Simmons to shoot.,30,994,250016,251010,image,FALSE
CompanyJ_79,Playoff Dak in full effect ,27,1952,249837,251789,image,FALSE
CompanyJ_80,Steph tried Harden's step-back and got called for a travel ,59,19226,683035,702261,video,FALSE
CompanyJ_81,Steph dropped Justin Jackson with one jab step he also dropped 10 triples as the Warriors and Kings set the all-time record for threes (41) ,140,3910,394429,398339,video,FALSE
CompanyJ_82,"Dak: 226 yards, 2 TD Zeke: 169 yards, TD Coop: 7 catches, 106 yards  The young stars showed up in their first playoff win ",122,1228,174820,176048,image,FALSE
CompanyJ_83,Young Flash  @zmane2s game is too smooth. (@br_hoops),53,525,89451,89976,video,FALSE
CompanyJ_84,#NAME?,55,797,108741,109538,video,FALSE
CompanyJ_85,Curry thought he could get away with it ,40,4806,281293,286099,video,FALSE
CompanyJ_86,Philip Rivers and the Chargers fry the Ravens 23-17,51,1467,90029,91496,video,FALSE
CompanyJ_87,"When you go through life, everythings not gonna be perfect. D-Rose speaks to a young fan with Leukemia pregame  (via @timberwolves)",131,4236,659847,664083,video,FALSE
CompanyJ_88,Coach Harbaugh let Lamar work through the growing pains.,56,4147,341371,345518,image,FALSE
CompanyJ_89,"Breaking: Timberwolves have fired Tom Thibodeau, per @shamsnba and Jon Krawczynski",82,4481,289992,294473,image,FALSE
CompanyJ_90,Playoff Foles keeps the Eagles season alive!,44,3016,148036,151052,video,FALSE
CompanyJ_91,Cody Parkey's potential game-winning FG hits crossbar twice as Eagles advance to Divisional Round  (via @nfl),109,2509,136083,138592,video,FALSE
CompanyJ_92,All of Chicago.,15,3937,373717,377654,image,FALSE
CompanyJ_93,Whos advancing to the Conference Championship? ,47,2550,147630,150180,carousel,FALSE
CompanyJ_94,Coach Thibs time in Minnesota is up!,36,326,62894,63220,video,FALSE
CompanyJ_95,D-Wade x Trae Young jersey exchange ,36,581,229627,230208,image,FALSE
CompanyJ_96,Millidelphia ,13,1777,328556,330333,image,FALSE
CompanyJ_97,More accomplishments for Flash  #OneLastDance,45,2469,369913,372382,image,FALSE
CompanyJ_98,Beasley told the ref he wanted to fight KAT then the ref gave KAT a tech ,73,4995,597140,602135,video,FALSE
CompanyJ_99,Kemba comes up clutch with the nasty step back ,47,1273,178165,179438,video,FALSE
CompanyJ_100,The Mamba offers his words of wisdom even though hes an Eagles fan.,67,3010,342423,345433,image,FALSE
CompanyJ_101,The legendary @tonyhawk breaks down some of his best moves  (via @skatejam),75,542,53213,53755,video,FALSE
CompanyJ_102,The NFL officially changes Cody Parkeys missed FG to a blocked kick by Treyvon Hester,85,3825,322093,325918,image,FALSE
CompanyJ_103,@stephencurry30 had these high school basketball teams hype after surprising them with 250+ pairs of the Curry 6  (@brkicks),124,165,25723,25888,video,FALSE
CompanyJ_104,Everyone wants to dance like Lance ,35,1145,187935,189080,video,FALSE
CompanyJ_105,DeMar and Coach Casey reunite  (via @nba),41,1363,295278,296641,video,FALSE
CompanyJ_106,The Brow breaks out the Shammgod ,33,1214,140407,141621,video,FALSE
CompanyJ_107,HARDEN DROPPED HIM.,19,10263,486090,496353,video,FALSE
CompanyJ_108,Fox told Vuc dont jump after he posterized him ,47,1761,245563,247324,video,FALSE
CompanyJ_109,Clemson adds its 2nd title to the Dabo Era!,43,1338,334732,336070,image,FALSE
CompanyJ_110,Theres a new dynasty in college football,40,861,145458,146319,video,FALSE
CompanyJ_111,Clemson has Bama's number ,26,1589,264105,265694,image,FALSE
CompanyJ_112,"What a night for the freshman.  347 yards, 3 TDs. 1 National Championship.",74,3408,423700,427108,image,FALSE
CompanyJ_113,Trevor Lawrence left Clemson fans starstruck ,45,1272,144113,145385,video,FALSE
CompanyJ_114,Career-high for Capela. Hes been EATING ,40,940,162131,163071,image,FALSE
CompanyJ_115,Which Harden ankle breaker was better? ,39,3059,153288,156347,video,FALSE
CompanyJ_116,"8 years ago today: Marshawn Lynchs Beast Quake, one of the greatest runs ever (via @nflthrowback)",97,3678,288696,292374,video,FALSE
CompanyJ_117,Trevor wants to fill up the trophy case ,40,1678,315926,317604,image,FALSE
CompanyJ_118,"Arizona Cardinals are hiring USC OC Kliff Kingsbury as their next head coach, per Peter Schrager",96,1501,159663,161164,image,FALSE
CompanyJ_119,The top playoff seeds spent the bye week trying to not freak out  #GridironHeights,82,1474,139109,140583,video,FALSE
CompanyJ_120,"7 years ago today, Tim Tebow threw for a career-high 316 yards + 2 TDs and led the Broncos to a 29-23 OT playoff win over Big Ben and the Steelers",146,3424,283567,286991,image,FALSE
CompanyJ_121,Zion is dunking everything ,27,760,134554,135314,video,FALSE
CompanyJ_122,Where does Embiids skill set rank among big men?,48,2223,264281,266504,image,FALSE
CompanyJ_123,Tonight could be Vince Carters last trip to Toronto. Never forget his 7 years up North:  5x All-Star  1999 Rookie of the Year  Helped the Raptors to their first ever playoff appearance in 2000  Threw down arguably the most memorable jam ever in the 2000 Dunk Contest,266,1205,322972,324177,image,FALSE
CompanyJ_124,"Not a bad night for Zion: 30 points (13-16), 10 boards, 5 assist, 4 steals. First Duke freshman in history to record 30/10/5 ",125,2586,447125,449711,image,FALSE
CompanyJ_125,"Prayers up for Nerlens Noel. The Thunder big man caught an elbow, hit his head and had to be stretchered off ",109,4777,492320,497097,video,FALSE
CompanyJ_126,The Joker gets the triple double and the tough game-winner ,59,928,175942,176870,video,FALSE
CompanyJ_127,"Sixers rookie @landryshamet hit 8 (!) threes tonight, so Embiid had to check his temperature ",93,1552,261915,263467,video,FALSE
CompanyJ_128,Russ went for the win...twice ,30,7979,298011,305990,video,FALSE
CompanyJ_129,"32-year-old Ryan Saunders, son of the late Flip Saunders, became the Timberwolves interim head coach after Thibs was fired on Sunday. Tonight he won his first game  (Via @timberwolves)",184,1317,287289,288606,video,FALSE
CompanyJ_130,Catch and shoot at its best.,28,4487,448142,452629,image,FALSE
CompanyJ_131,#NAME?,80,2575,289793,292368,image,FALSE
CompanyJ_132,"Sean Payton went into the Saints locker room with the Lombardi trophy on top of $225k in cash (Saints players SB bonus) and said Yall want this? Win 3 f--king games,"" per @nolalawyer",182,10336,516232,526568,image,FALSE
CompanyJ_133,Bucks vs. Rockets tonight. Who has the better MVP case?,55,2322,211854,214176,image,FALSE
CompanyJ_134,This Steelers Super Bowl XLIII hero knew they were going to winso he snuck his video camera onto the field at halftime ,119,185,49464,49649,video,FALSE
CompanyJ_135,Steph Curry is launching an 'Underrated Tour' to find overlooked high school prospects.  Curry was a 3-star recruit ranked 256th overall in the 2006 class,154,4129,381022,385151,image,FALSE
CompanyJ_136,Oubre slapped the floor then got scored on by Luka ,51,5957,463633,469590,video,FALSE
CompanyJ_137,The Beard has been on a tear lately ,36,1874,234988,236862,image,FALSE
CompanyJ_138,"Oakland As expect Kyler Murray to declare for NFL Draft, per susanslusser/Twitter",81,5941,367527,373468,image,FALSE
CompanyJ_139,The only way to stop Harden ,28,2834,168808,171642,video,FALSE
CompanyJ_140,Dame switched mid air ,22,1975,226513,228488,video,FALSE
CompanyJ_141,Harden is never trying to hear Sicko Mode again...,50,2987,313954,316941,video,FALSE
CompanyJ_142,"About a month ago, UCF QB McKenzie Milton almost lost his leg after a catastrophic knee injury. Today he leg pressed 40 pounds  (via @mckenziemil10)",148,1085,160367,161452,video,FALSE
CompanyJ_143,Lonzo was doing a little bit of everything tonight ,51,3327,375649,378976,video,FALSE
CompanyJ_144,Kyle Kuzma couldnt be stopped tonight ,38,1474,328370,329844,image,FALSE
CompanyJ_145,"95% of players surveyed think Colin Kaepernick should be on an NFL roster, per @theathletichq",93,13761,500840,514601,image,FALSE
CompanyJ_146,Lakers players shared their most common celebrity look-alike... cant unsee,74,4091,232134,236225,video,FALSE
CompanyJ_147,These fans traveled from Pakistan to see Giannis and all they wanted was photo proof of how huge his hands are (via @nba),121,1957,344621,346578,video,FALSE
CompanyJ_148,At least he was honest ,23,2147,376197,378344,image,FALSE
CompanyJ_149,Russell Wilson will join the Yankees for spring training,56,3685,382931,386616,image,FALSE
CompanyJ_150,"Tarik Cohen tried it, but then ended up getting mixed by a fan at the gym  (via @z.aia.merza, @nathanmihulet637)",112,2794,256979,259773,video,FALSE
CompanyJ_151,DeMar DeRozan. Goodness. ,25,732,146734,147466,video,FALSE
CompanyJ_152,They couldn't believe Tyler Johnson's tongue injury ,52,665,157670,158335,video,FALSE
CompanyJ_153,"Final score: Spurs 154, Thunder 147 in double OT  SA hit 14-straight 3's to start the game Four OKC players drop 20+ PTS LMA goes for a 50-piece Brodie records 24 PTS and 24 AST",177,3663,471369,475032,image,FALSE
CompanyJ_154,LMA with a career-high 56 in the win over the Thunder ,54,1865,339438,341303,image,FALSE
CompanyJ_155,"Drew Brees is the NFLs all-time passing leader, but never gets included in  talk. Is he the most underrated QB in history?",122,3864,160550,164414,video,FALSE
CompanyJ_156,"In 2001, Randy Moss wore custom Jordan 11s in the Divisional Round: 2 catches, 121 yards, 2 TD @brkicks  (via @nflthrowback)",124,2643,235864,238507,video,FALSE
CompanyJ_157,Have the Cardinals found the next Sean McVay in Kliff Kingsbury?,64,883,76560,77443,video,FALSE
CompanyJ_158,The Sixers are retiring the late Moses Malones number. One of the NBA/ABAs most underrated icons.  3x MVP 1983 Finals MVP  13x All-Star  9th in points  1st in off. rebounds  3rd in total rebounds,195,1730,291179,292909,image,FALSE
CompanyJ_159,"Zeke led the NFL in rushing yards this season (1,434), but will it be enough to get past the Rams?",98,357,26986,27343,video,FALSE
CompanyJ_160,"FSU coach Leonard Hamilton on Zion: The most phenomenal talent in the ACC since Michael Jordan."" (via @warchantofficial)",120,3726,461806,465532,image,FALSE
CompanyJ_161,Bill Belichick wins when it matters most.,41,457,61529,61986,video,FALSE
CompanyJ_162,Cam knows from experience.,26,8216,379092,387308,image,FALSE
CompanyJ_163,"KAT added a little extra, Dirk wasnt having it",46,3618,350092,353710,video,FALSE
CompanyJ_164,"TJ pulling Jimmy away after the elbow, Butler wasnt having it",61,2439,309444,311883,video,FALSE
CompanyJ_165,Ref made it look like he meant to fall,38,1292,210617,211909,video,FALSE
CompanyJ_166,Rose told Doncic to SIT DOWN.,29,5248,394346,399594,video,FALSE
CompanyJ_167,Luka is not a normal rookie. Wow.,33,5157,417930,423087,video,FALSE
CompanyJ_168,Might as well give the 19-year-old ROY now ,43,2927,421347,424274,image,FALSE
CompanyJ_169,Steph joins the top-3 already and he's only 30 ,47,2847,343985,346832,image,FALSE
CompanyJ_170,Spida vs. JaVale ,17,2256,255797,258053,video,FALSE
CompanyJ_171,What is going on in Indianapolis? (via @thecheckdown),53,7945,405419,413364,video,FALSE
CompanyJ_172,Scotty Pippen Jr is going to be a problem at Vanderbilt @br_hoops,65,1285,143926,145211,video,FALSE
CompanyJ_173,63 Spida climbed over 70 JaVale,31,1375,290009,291384,image,FALSE
CompanyJ_174,Is ketchup the secret fuel to Mahomes MVP-caliber season?,57,1020,108438,109458,video,FALSE
CompanyJ_175,"Mac McClung AT THE BUZZER in regulation, James Akinjo with 3 seconds left in OT ",80,1554,297143,298697,video,FALSE
CompanyJ_176,Curry and KD recruiting Lopez after this,40,2005,367961,369966,video,FALSE
CompanyJ_177,Was he even going for the ball? ,32,5543,385865,391408,image,FALSE
CompanyJ_178,Mahomes sidearm is unstoppable  (via @nfl),42,641,116563,117204,video,FALSE
CompanyJ_179,Devin Booker is pledging $2.5M over the next five years to Arizona kids and families in need ,93,2092,377380,379472,image,FALSE
CompanyJ_180,Mahomes and the Chiefs move on to the AFC Championship ,55,1906,201737,203643,video,FALSE
CompanyJ_181,Uncle Drew brought out the playground package against the Magic ,64,903,210648,211551,video,FALSE
CompanyJ_182,Tough day for Adam Vinatieri ,29,1924,225230,227154,video,FALSE
CompanyJ_183,Kyrie was frustrated with Gordon Hayward and Celtics' last shot ,64,5657,388305,393962,video,FALSE
CompanyJ_184,Russ had Belinelli on skates ,29,3341,340261,343602,video,FALSE
CompanyJ_185,This has been a WILD year for C.J. Anderson  Cut by Broncos  Benched and waived by Panthers  Waived by Raiders without one snap  Signed by Rams as Gurley insurance  Averaged 149.5 yards for L.A.  Playoff hero,208,2440,421306,423746,image,FALSE
CompanyJ_186,Rams advance to the NFC Championship.,37,1264,239704,240968,image,FALSE
CompanyJ_187,Bron in the Rams locker room after the W  (via @obeezy45),57,7922,576690,584612,video,FALSE
CompanyJ_188,T.O. has seen enough.,21,2340,216920,219260,image,FALSE
CompanyJ_189,#NAME?,46,4341,524542,528883,video,FALSE
CompanyJ_190,Kyrie speaks from experience,28,6112,394529,400641,image,FALSE
CompanyJ_191,Snoop Dogg commentating NHL is the best thing you'll hear today  (via @lakings),79,10413,565880,576293,video,FALSE
CompanyJ_192,DWade and Gabrielle Union were out their seats for @zmane2s finish @br_hoops,76,626,168800,169426,video,FALSE
CompanyJ_193,Rivers has been no match for Brady.,35,890,74910,75800,video,FALSE
CompanyJ_194,History  Sarah Thomas becomes the first woman to officiate an NFL playoff game in Chargers/Patriots.,100,7112,502151,509263,image,FALSE
CompanyJ_195,Klay been practicing to be a Warrior all his life (via @nbcsauthentic),70,784,271530,272314,video,FALSE
CompanyJ_196,Brady moves to 8-0 against Rivers as the Pats advance to the AFC Championship!,78,3305,391687,394992,image,FALSE
CompanyJ_197,The breakout superstar. The 41-year-old icon. A shot at the Super Bowl.,71,1552,187150,188702,image,FALSE
CompanyJ_198,"Kyler Murray wants a $15M contract from As to stick with baseball, otherwise hell enter NFL Draft tomorrow, per @mikelesliewfaa",127,9899,519070,528969,image,FALSE
CompanyJ_199,Greek Freak x Half-Man Half-Amazing jersey swap ,48,487,183984,184471,video,FALSE
CompanyJ_200,Saints advance to the NFC Championship!,39,2380,161169,163549,video,FALSE
CompanyJ_201,Brutal drop for Alshon. Incredible game clincher for Lattimore. (via @nfl),74,2247,172542,174789,video,FALSE
CompanyJ_202,Giants fans ecstatic ,21,3356,193473,196829,video,FALSE
CompanyJ_203,"Thats why they call him @cantguardmike  12 catches, 171 yards, 1 TD ",68,4597,469632,474229,image,FALSE
CompanyJ_204,Rematch in NOLA. Who ya got?,28,2452,189531,191983,image,FALSE
CompanyJ_205,"That was dirty, Luka.",21,1287,198064,199351,video,FALSE
CompanyJ_206,Curry. Clutch. Steph dropped 48 points and 11 threes against the Mavs ,70,3222,357814,361036,video,FALSE
CompanyJ_207,This is  (via @vol_hoops),25,3004,466589,469593,video,FALSE
CompanyJ_208,"With their loss to the Cavs at home tonight, the Lakers are now 3-7 without LeBron...",85,4696,417897,422593,image,FALSE
CompanyJ_209,Lakers GM Rob Pelinka pacing outside the arena after the Lakers loss to the Cavs... (via @lojomedia),100,7453,408553,416006,video,FALSE
CompanyJ_210,Brady is different in the postseason ,37,1173,103190,104363,video,FALSE
CompanyJ_211,AB to the Niners ,17,7573,377994,385567,image,FALSE
CompanyJ_212,The Cavs 3-1 comeback will live forever in history.,51,4791,377973,382764,image,FALSE
CompanyJ_213,Kyler Murray chose the gridiron over the baseball diamond...but did he make the right choice? Only time will tell.,114,772,82980,83752,video,FALSE
CompanyJ_214,Spurs fans gave Tony Parker a ton of love during his tribute video ,67,1224,259448,260672,carousel,FALSE
CompanyJ_215,"DOWN GOES DUKE  Syracuse upsets No. 1 Duke, 95-91",49,3798,331372,335170,image,FALSE
CompanyJ_216," ""Kyrie's leaving""  Celtics are getting blown out by the Nets and Brooklyn fans aren't holding back ",100,3941,344448,348389,video,FALSE
CompanyJ_217,The Beard continued his historic scoring tear with 57 points tonight. MVP? ,75,3493,278818,282311,image,FALSE
CompanyJ_218,57 PTS for The Beard. This man is unstoppable.,46,4232,238809,243041,video,FALSE
CompanyJ_219,57 points. It all makes sense. ,31,3119,453164,456283,image,FALSE
CompanyJ_220,Tony Parker and Pop share a moment after the game ,50,510,164735,165245,video,FALSE
CompanyJ_221,Joe Ingles blows a kiss to Pistons fans after sealing the win ,62,3579,393030,396609,video,FALSE
CompanyJ_222,Boban is the best  (via @nbatv),31,1651,217431,219082,video,FALSE
CompanyJ_223,"2009 (9.9 PPG, 3.2 RPG, 1.8 APG) vs 2019 (34.8 PPG, 6.3 RPG, 8.6 APG) ",70,3982,450446,454428,image,FALSE
CompanyJ_224,"6'1"" Fran Belibi threw down the first alley-oop in girls HS history. Now she wants to inspire other female hoopers  @br_hoops",125,1893,120357,122250,video,FALSE
CompanyJ_225,"She had him wobbly  (via @arianadossantos10, @brfootball)",57,1032,76809,77841,video,FALSE
CompanyJ_226,Kyrie clears the air.,21,2909,342445,345354,image,FALSE
