UI_ID,Caption,Character Count,Comments Count,Likes Count,Total Actions,Media Type,Includes Hashtag
CompanyJ_2638,Bring it back @kingjames!,25,5070,493397,498467,image,FALSE
CompanyJ_2639,"LeBron is gifting AD his No. 23 jersey, per @chrisbhaynesnba  AD waived his $4M trade kicker today and the Lakers now have $32M in cap space, per @wojespn",154,10090,738179,748269,carousel,FALSE
CompanyJ_2640,"Kawhi intends to meet with Lakers and Clippers when free agency starts, per @chrisbhaynesnba",92,3846,406649,410495,video,FALSE
CompanyJ_2641,OBJ  JuJu  Tarik   Lot of one-handed grabs at minicamp and OTAs @brgridiron,75,371,77961,78332,video,FALSE
CompanyJ_2642,AD is taking 23. Is No. 6 Bron back?,36,9388,842464,851852,image,FALSE
CompanyJ_2643,Megan Rapinoe on saying shes not going to the fking White House: I stand by the comments I made ... with the exception of the expletive.,136,6965,178514,185479,video,FALSE
CompanyJ_2644,He didnt have to do them like that  (via @matthewcerilli),57,1533,207276,208809,video,FALSE
CompanyJ_2645,"Kyrie Irving remains just as much of a target for the Lakers as Kawhi Leonard now that they have maximum cap space, per @marcsteinnba",133,5930,563226,569156,image,FALSE
CompanyJ_2646,TODAY. The reigning champions vs. the hosts in the World Cup quarterfinals ,75,858,121370,122228,image,FALSE
CompanyJ_2647,#NAME?,132,819,212523,213342,video,FALSE
CompanyJ_2648,"Fresh off an MVP season, Giannis gets his own signature shoe  (via @brkicks)",76,3720,518826,522546,carousel,FALSE
CompanyJ_2649,"RECOVERY FROM THE GOALKEEPER  (via @pifen2024, h/t @brfootball)",63,6079,408363,414442,video,FALSE
CompanyJ_2650,He tried to guard Giannis 1-on-1  (via @master_tesfatsion),58,2037,259443,261480,video,FALSE
CompanyJ_2651,Leonard proved to every critic that his championship DNA is unquestionable,74,1819,327845,329664,video,FALSE
CompanyJ_2652,US fans traveling in NUMBERS to the @uswnts quarterfinal  (via @americanoutlaws),80,761,85445,86206,video,FALSE
CompanyJ_2653,76ers will have the highest stakes in free agency after going all-in for a playoff run,86,635,117514,118149,video,FALSE
CompanyJ_2654,The @uswnt are through to the World Cup semifinals!,51,1735,226443,228178,image,FALSE
CompanyJ_2655,ICONIC  Four goals in two games for @mrapinoe,45,3822,344761,348583,carousel,FALSE
CompanyJ_2656,"LeBron and Anthony Davis plan to be part of Lakers' free agency pitch to Kawhi, per @sramick",92,6147,477682,483829,image,FALSE
CompanyJ_2657,Max Holloway just won the bottle cap challenge  (via @blessedmma),65,2192,247134,249326,video,FALSE
CompanyJ_2658,KDs injury wont stop him from signing wherever he wants   Where will he land?,77,4391,401013,405404,image,FALSE
CompanyJ_2659,"Kevin Durant ""planning to engage"" Warriors, Nets, Clippers, and Knicks at the start of free agency Sunday, per @wojespn",119,2002,331099,333101,image,FALSE
CompanyJ_2660,Khabib ready for his max contract  (via @khabib_nurmagomedov),61,5549,183549,189098,video,FALSE
CompanyJ_2661,"Darren Collison has retired from the NBA after 10 seasons, per @marcjspears",75,8885,616566,625451,image,FALSE
CompanyJ_2662,"Lakers are a ""true threat"" to sign Kahwi away from Raptors; LAL believe they've won the sweepstakes for Leonard, per @marcsteinnba",130,10942,649024,659966,image,FALSE
CompanyJ_2663,"Fun Guy turns 28 today  NBA champion on two different teams  Only player with a Finals MVP in both conferences  About to hit his prime  Happy birthday, Kawhi ",158,2718,487286,490004,image,FALSE
CompanyJ_2664,"Klay Thompson and Warriors plan to reach an agreement on five-year, $190M max contract within the next day, per @shamsnba",121,3522,414574,418096,image,FALSE
CompanyJ_2665,"You coming to New York, bro? Kawhi has a history with fans in NY  (via Jerry West/FB)",85,4819,381391,386210,video,FALSE
CompanyJ_2666,The World Cup final four are set ,33,1176,197090,198266,image,FALSE
CompanyJ_2667,Free agency was Durant's decision and team's aren't worried about his comeback,78,2428,350220,352648,video,FALSE
CompanyJ_2668,"Pistons ""emerging as the favorite"" to sign Derrick Rose, per @thefrankisola",75,4363,452500,456863,image,FALSE
CompanyJ_2669,Bronny wanted to flex his building in Fortnite real quick  (via @bronny),72,1534,156050,157584,video,FALSE
CompanyJ_2670,"Kemba Walker ""plans to commit"" to four-year, $141M max deal with Celtics at beginning of free agency, per @shamsnba ",116,10675,707770,718445,image,FALSE
CompanyJ_2671,"Kyrie Irving and Nets motivated to move quickly towards four-year, $141M max deal when they meet in New York on Sunday, per @wojespn",132,4634,453800,458434,image,FALSE
CompanyJ_2672,Lakers fans doing their part in recruiting Kawhi  (via @gz.jr),62,4069,469465,473534,image,FALSE
CompanyJ_2673,Happy Birthday to the late Craig Sager. These moments were hysterical  (via @nba),81,2310,400472,402782,video,FALSE
CompanyJ_2674,NBA FREE AGENCY. TONIGHT. 6 p.m. ET ,36,2881,515084,517965,image,FALSE
CompanyJ_2675,#NAME?,68,1981,310920,312901,carousel,FALSE
CompanyJ_2676,#NAME?,61,2790,244891,247681,image,FALSE
CompanyJ_2677,Had him walking away to look for it  (via @solarjoy),52,1021,211128,212149,video,FALSE
CompanyJ_2678,"Jimmy Butler is expected to tell MIA officials he wishes to play for the Heat tonight, per @bytimreynolds",105,5039,456701,461740,image,FALSE
CompanyJ_2679,"Dame DOLLA  Lillard is working toward a four-year, $196M supermax extension with Blazers, per @shamsnba ",104,5888,574529,580417,image,FALSE
CompanyJ_2680,"Wolves are at the top of DAngelo Russells wish list  Minnesota is increasingly confident it can make the cap moves to land D-Lo, per @marcsteinnba",146,4734,393956,398690,image,FALSE
CompanyJ_2681,"KD'S DECISION TONIGHT.  Durant will announce where he's going on @theboardroom, per @wojespn",92,10373,449220,459593,image,FALSE
CompanyJ_2682,Decisions for Kawhi Leonard ,28,1673,222622,224295,video,FALSE
CompanyJ_2683,"The Nets seem to believe theyre getting KD along with Kyrie and DeAndre Jordan tonight, per @marcsteinnba",105,5300,493166,498466,image,FALSE
CompanyJ_2684,"Breaking: KD is planning to sign a 4-year, $164M deal with the Nets, per @wojespn",81,24202,1053813,1078015,image,FALSE
CompanyJ_2685,Draymond watching KD leave..,28,21484,814920,836404,video,FALSE
CompanyJ_2686,Knicks fans after the KD-Kyrie announcement,43,15003,711912,726915,video,FALSE
CompanyJ_2687,"Kemba Walker is joining the Celtics on a 4-year, $141M max contract, per @wojespn (from B/R X @americanexpress)",111,2280,305566,307846,video,FALSE
CompanyJ_2688,"D-Rose has agreed to a 2-year, $15M deal with the Pistons, per @wojespn",71,6400,769772,776172,image,FALSE
CompanyJ_2689,"Dame signs a 4-year, $194M supermax extension with the Blazers, per @chrisbhaynesnba (NSFW)",91,2295,287695,289990,video,FALSE
CompanyJ_2690,"Knicks were ""not fully prepared"" to offer KD a full max contract with concerns over his recovery, per @ramonashelburne",118,10887,496620,507507,image,FALSE
CompanyJ_2691,"Heat are finalizing a sign-and-trade with 76ers for Jimmy Butler, per @wojespn",78,6856,686772,693628,image,FALSE
CompanyJ_2692,"Al Horford has agreed to 4-year, $109M deal with the 76ers, per @wojespn",72,6604,443293,449897,image,FALSE
CompanyJ_2693,Brooklyn's Big 3 (from B/R x @americanexpress),46,4437,372848,377285,video,FALSE
CompanyJ_2694,"D'Angelo Russell has been traded to to Warriors in sign-and-trade deal with Nets, per @wojespn",94,37339,1101123,1138462,image,FALSE
CompanyJ_2695,"The Warriors have traded Iggy to the Grizzlies, per @wojespn",60,11173,521401,532574,image,FALSE
CompanyJ_2696,D-Lo to the Warriors. What a wild Day 1 of free agency so far. (from B/R x @americanexpress),92,2801,257078,259879,video,FALSE
CompanyJ_2697,That new Philly five ,21,13856,744253,758109,image,FALSE
CompanyJ_2698,Now we wait for the Board Man.  KD: Nets Kyrie: Nets D-Lo: Warriors Kemba: Celtics Jimmy: Heat Horford: 76ers Tobias: 76ers Middleton: Bucks Redick: Pelicans Porzingis: Mavs Bogdanovic: Jazz Brogdon: Pacers Randle: Knicks Rose: Pistons Pat Bev: Clippers,253,4442,424811,429253,image,FALSE
CompanyJ_2699,KDs brother showing off that new 35 Brooklyn jersey (via @tdurant),66,2225,307825,310050,video,FALSE
CompanyJ_2700,Kyrie linked up with KD in Brooklyn after two wild seasons in Boston,68,1229,176593,177822,carousel,FALSE
CompanyJ_2701,"Breaking: Klay and the Warriors agree to a 5-year/$190M max deal, per multiple reports",86,3040,402237,405277,video,FALSE
CompanyJ_2702,Newest addition in Portland   @hassanwhiteside,46,8254,698266,706520,image,FALSE
CompanyJ_2703, @mrapinoe,10,1365,141736,143101,image,FALSE
CompanyJ_2704,Will Bynum broke out a fake Shammgod at @thebig3 ,49,2750,283392,286142,video,FALSE
CompanyJ_2705,"@jaytatum0 pulled up to Quai 54 in Paris, one of the worlds biggest streetball tournaments, and surprised these kids with a truck full of new  @Jumpman23. New Sneaker Shock  (@brkicks)",184,194,123327,123521,video,FALSE
CompanyJ_2706,Joe Lacob says no Warrior will wear No. 35 as long as he is co-chairman of the team.,84,5103,443098,448201,image,FALSE
CompanyJ_2707,"You get a bag, you get a bag, you get a bag...NBA players signed for more than $3B on the first day of free agency ",115,919,169660,170579,video,FALSE
CompanyJ_2708,"Isaiah Thomas has agreed to a 1-year deal with the Wizards, per @wojespn",72,5382,607894,613276,image,FALSE
CompanyJ_2709,Dylan Windler is a bucket...  (via @nbatv),42,2193,271800,273993,video,FALSE
CompanyJ_2710,Bam Bam Kam Chancellor was a bad man  @brgridiron  The Enforcer walked away from the game one year ago today (via @thecheckdown),128,2504,371364,373868,carousel,FALSE
CompanyJ_2711,TODAY  England vs. @uswnt  For a spot in the World Cup final ,61,962,132790,133752,image,FALSE
CompanyJ_2712, NEW York Knicks ,17,38254,571186,609440,image,FALSE
CompanyJ_2713,@flash_garrett is built different   @brgridiron  Squatting 675 lbs  Box jumps with 50s,86,8488,252304,260792,video,FALSE
CompanyJ_2714, ,1,3748,531808,535556,carousel,FALSE
CompanyJ_2715,The @uswnt are headed back to the World Cup final! ,51,1624,252385,254009,image,FALSE
CompanyJ_2716,WHAT  A  GAME ,14,1040,219475,220515,carousel,FALSE
CompanyJ_2717,Vlads moonshots are disappearing into the lights  (via @alexisbrudnicki),72,4882,453845,458727,video,FALSE
CompanyJ_2718,"Patrick Corbin wearing No. 45 to honor Tyler Skaggs, writes the number on the mound for his late friend (via @mlbcut4)",118,869,286487,287356,carousel,FALSE
CompanyJ_2719,#NAME?,56,1596,442623,444219,image,FALSE
CompanyJ_2720,Another missed shot at an international trophy for Messi  (via @brfootball),75,3683,355988,359671,image,FALSE
CompanyJ_2721,Angels held a moment of silence and wore special patches tonight to honor late pitcher Tyler Skaggs ,100,691,230812,231503,image,FALSE
CompanyJ_2722,This team.  @uswnt  (via @brfootball),37,2058,231398,233456,image,FALSE
CompanyJ_2723,"@wojespn says he was told not to expect a Kawhi decision until at least later today, possibly tomorrow on July 4th",114,4303,456769,461072,image,FALSE
CompanyJ_2724,End of an era ,14,3366,631017,634383,image,FALSE
CompanyJ_2725, (via @brfootball),18,3172,247311,250483,image,FALSE
CompanyJ_2726,"Knicks big man Mitchell Robinson is changing from No. 26 to No. 23 to honor two childhood friends and former teammates who died.  One wore No. 2, the other wore No. 3  (via @nypost)",181,1764,367174,368938,image,FALSE
CompanyJ_2727,Former Giants QB Jared Lorenzen has died at the age of 38.,58,3831,318966,322797,image,FALSE
CompanyJ_2728,USA vs. The Netherlands  Sundays #FIFAWWC final is set ,55,1384,180364,181748,image,TRUE
CompanyJ_2729,Your favorite rappers are getting buckets on the basketball court ,66,2146,159983,162129,video,FALSE
CompanyJ_2730,"Knicks reportedly cancelled a meeting with Kawhi Leonard in fear of missing out on other free agents, per @nypost",113,20504,653895,674399,image,FALSE
CompanyJ_2731,"Legendary, @alexmorgan13  (via @brfootball)",43,498,77881,78379,video,FALSE
CompanyJ_2732,Coach and former NBA player Ricky Davis thinks he was one of the best players there  (via @br_hoops),100,952,277232,278184,video,FALSE
CompanyJ_2733,"Kawhi is not expected to make free agency decision until next few days. He and his reps are taking their time before deciding, per @theathletichq",145,4358,383156,387514,image,FALSE
CompanyJ_2734,Zion is gonna be so fun  (via @pelicansnba),43,3130,309437,312567,video,FALSE
CompanyJ_2735,Happy Fourth of July! ,22,698,137622,138320,image,FALSE
CompanyJ_2736,Giannis view in Greece looks like a painting  (via @giannis_an34),65,2375,428225,430600,video,FALSE
CompanyJ_2737,These throwback looks are the vibe for every BBQ this July 4th,62,542,176486,177028,carousel,FALSE
CompanyJ_2738,#NAME?,38,2867,547782,550649,carousel,FALSE
CompanyJ_2739,"KD to BK isnt the first time he shook up the league  3 years ago today, he left OKC for the Bay and the rest is history",119,926,131931,132857,video,FALSE
CompanyJ_2740,"Five-star recruit Jalen Johnson has verbally committed to Duke, per @evandaniels  Swipe  for highlights! @br_hoops",114,1090,218826,219916,carousel,FALSE
CompanyJ_2741,#NAME?,50,5426,263915,269341,video,FALSE
CompanyJ_2742,This is unreal  (via @wade_bright),34,4064,707559,711623,video,FALSE
CompanyJ_2743,"Four years ago today, the @USWNT won the World Cup for the third time. On Sunday, they go for No. 4  ",101,749,123183,123932,image,FALSE
CompanyJ_2744,Summer league always goes OFF. Which rookie will tear it up this year?,70,592,77794,78386,video,FALSE
CompanyJ_2745,Dreamville got their revenge on the rap game ,45,3377,380599,383976,image,FALSE
CompanyJ_2746,#NAME?,102,9013,333282,342295,video,FALSE
CompanyJ_2747,Thats why @abs footwork and hands are elite  (via @doctor_reef),63,3177,333327,336504,video,FALSE
CompanyJ_2748,WHAT A COMEBACK.  15-year-old Coco Gauff comes back from being a set down to advance to the Round of 16 at Wimbledon ,117,2014,294749,296763,carousel,FALSE
CompanyJ_2749,"@shareefoneal got new ink of the vintage @shaq alley-oop reaction  (: @koolmac, @stevewiebe)",92,921,210705,211626,carousel,FALSE
CompanyJ_2750,"Wizards have traded Dwight Howard to the Grizzlies for CJ Miles, per @shamsnba & @wojespn",89,5483,359749,365232,image,FALSE
CompanyJ_2751,@paulpogba got a 2-for-1 ,25,945,146749,147694,video,FALSE
CompanyJ_2752,Zion 360  (via @NBA),20,3040,428533,431573,video,FALSE
CompanyJ_2753,An earthquake happened during the Knicks-Pelicans summer league game and all games have been postponed for tonight ,115,1973,282764,284737,video,FALSE
CompanyJ_2754,Zion did not disappoint in his summer league debut ,51,4018,369800,373818,video,FALSE
CompanyJ_2755,"Fun guy goes Hollywood  Kawhi Leonard will join the Los Angeles Clippers, per @chrisbhaynesnba",94,26314,1047300,1073614,image,FALSE
CompanyJ_2756,"Breaking: Thunder are sending Paul George to the Clippers, per @wojespn",71,19227,793974,813201,image,FALSE
CompanyJ_2757,"What it do, Clippers!",21,4441,421725,426166,video,FALSE
CompanyJ_2758,The battle for LA just got real ,32,9795,734200,743995,image,FALSE
CompanyJ_2759,Lakers front office after Kawhis decision:,42,7304,508472,515776,video,FALSE
CompanyJ_2760,NBA free agency has flipped the league upside down.,51,6226,699144,705370,image,FALSE
CompanyJ_2761,The new dynamic duo in LA ,26,10847,867447,878294,image,FALSE
CompanyJ_2762,Last man standing.,18,18355,915985,934340,image,FALSE
CompanyJ_2763,"OKC offered Westbrook and PG-13 to the Raptors with Siakam as the centerpiece of an asset-crippling deal, but Toronto turned it down, per @wojespn",146,9982,525517,535499,image,FALSE
CompanyJ_2764,That Clippers defense  Pat Bev  Kawhi  PG  Trezl,48,6007,534437,540444,carousel,FALSE
CompanyJ_2765,New title favorites after last night  (via @br_betting),55,4489,301591,306080,image,FALSE
CompanyJ_2766,LakeShow summer ,16,18591,887701,906292,image,FALSE
CompanyJ_2767,"Westbrook and his agent are engaged with OKC GM Sam Presti about a potential trade, per @wojespn",96,22434,641000,663434,image,FALSE
CompanyJ_2768,"Breaking: BOOGIE to LA.  Cousins agrees to a one-year deal with the Lakers, per @wojespn",88,39318,1202054,1241372,image,FALSE
CompanyJ_2769,"Rondos back in LA.  The point guard is returning to the Lakers on a two-year deal, per @wojespn and @ramonashelburne",116,3937,609968,613905,image,FALSE
CompanyJ_2770,"AD was catching lobs from LBJ in 2018 while rocking the Boogie jersey.  Brow was honoring his Pelicans teammate, who tore his Achilles.  All Lakers teammates now ",162,1438,359585,361023,video,FALSE
CompanyJ_2771,@taylorrooks put him through the ringer but @drehunter_ handled his business at this mock press conference   From B/R x @jcpenney,129,152,33898,34050,video,FALSE
CompanyJ_2772,"Zion (bruised knee) is out for the rest of Summer League, David Griffin announced.",82,6858,522226,529084,image,FALSE
CompanyJ_2773,"The Pacers drafted Kawhi Leonard and Paul George in back-to-back years, but they traded the Kawhi pick to the Spurs for George Hill  What couldve been..."" is becoming reality with LAC",183,2686,421013,423699,image,FALSE
CompanyJ_2774,Kawhi Leonard is the first player in NBA history to join a new team right after winning Finals MVP,98,4250,499408,503658,image,FALSE
CompanyJ_2775,Jerry West continues to make banner moves as an executive:  Helped build 1980s Lakers dynasty  Traded Vlade Divac for Kobe  Convinced Shaq to sign with LAL  Stopped Klay-for-Kevin Love trade  Helped recruit KD to Warriors  Signed Kawhi & PG13 in one night,255,4910,538363,543273,image,FALSE
CompanyJ_2776,The World Cup final is TOMORROW @USWNT vs. The Netherlands,58,1075,172349,173424,image,FALSE
CompanyJ_2777,Khabib and Nate Diaz got into an altercation and had to be separated at UFC 239  *NSFW* (via @mattwreford95),108,5347,385729,391076,video,FALSE
CompanyJ_2778,Jon Jones had to be carried out of the octagon after his victory at #UFC239 (via @andreashale),94,1396,240199,241595,video,TRUE
CompanyJ_2779,WORLD CUP FINAL DAY. The defending champions look to bring it home again . Follow @brfootball for everything #uswnt ,116,826,176516,177342,image,TRUE
CompanyJ_2780,"Rival execs have pinpointed the Rockets as a likely suitor in a potential Westbrook trade, per @sramick and @bdawsonwrites  Brodie  Beard reunion?",146,9762,577846,587608,carousel,FALSE
CompanyJ_2781,The crowd in Kansas City for the @uswnt is SERIOUS  (via @sportingkc),69,1620,160505,162125,video,FALSE
CompanyJ_2782,THE @USWNT ARE WORLD CHAMPIONS AGAIN!  @brfootball,50,3337,410429,413766,image,FALSE
CompanyJ_2783,Dominance.,10,1167,237568,238735,image,FALSE
CompanyJ_2784,6 goals and 3 assists in 5 games.  Megan Rapinoe wins the 2019 World Cup Golden Boot AND Golden Ball  (via @brfootball),119,3190,292081,295271,image,FALSE
CompanyJ_2785, L E G E N D A R Y ,19,2098,329651,331749,carousel,FALSE
CompanyJ_2786,The Warriors are retiring Andre Iguodalas No. 9 jersey.  3x champ  2015 Finals MVP,82,6398,567130,573528,image,FALSE
CompanyJ_2787,The USWNT went wild in the locker room after the win  *NSFW* (via @ashlynharris24),82,9299,662789,672088,video,FALSE
CompanyJ_2788,Julie Ertzs World Cup Trophy photoshoot  >>>,44,891,260993,261884,carousel,FALSE
CompanyJ_2789,Pinoe pays tribute to Nipsey.  Respect  (via @brfootball),57,3648,256441,260089,image,FALSE
CompanyJ_2790,The way Jimmy threw the pen after signing his contract  (via @miamiheat),72,3292,451576,454868,video,FALSE
CompanyJ_2791,KD will switch to No. 7 on the Nets after wearing No. 35 for this whole career (via @easymoneysniper),101,9717,659352,669069,image,FALSE
CompanyJ_2792,Brooklyns new duo is official  Swipe ,37,1790,321671,323461,carousel,FALSE
CompanyJ_2793,When the @uswnt sealed their fourth World Cup  (via @brfootball),64,326,56201,56527,video,FALSE
CompanyJ_2794,"Nine years ago today, LeBron joined the Heat and changed the league with The Decision",85,3465,413345,416810,image,FALSE
CompanyJ_2795,"15-year-old phenom @cocogauff has been eliminated from Wimbledon after an unbelievable run.  Youngest to reach main draw  Beat Venus, a childhood idol  Advanced to Round of 16  Only the beginning.",196,1304,240119,241423,image,FALSE
CompanyJ_2796,JR showed up to the MLB All Star celebrity game without a shirt ,64,2435,454171,456606,carousel,FALSE
CompanyJ_2797,PG-13 talking about Kawhi in September  (via @_theoklahoman / YouTube),70,2500,428438,430938,video,FALSE
CompanyJ_2798,"Neymar was a no-show for the start of PSG preseason training today, amid rumors of a return to Barcelona  (@brfootball)",119,1307,243200,244507,image,FALSE
CompanyJ_2799,"New chapter, new number ",24,4320,442407,446727,image,FALSE
CompanyJ_2800,Big comebacks on the biggest stage ,35,209,38000,38209,video,FALSE
CompanyJ_2801,#NAME?,75,1276,164096,165372,video,FALSE
CompanyJ_2802,"The Lakers plan to start LeBron at point guard this year, per @chrisbhaynesnba  SHOWTIME ",89,13301,708085,721386,image,FALSE
CompanyJ_2803,The #BottleCapChallenge is taking over the sports world ,56,495,91277,91772,video,TRUE
CompanyJ_2804,"Westbrook is welcoming the idea of a trade from OKC after 11 years. Miami has expressed interest and appeals to Russ, per @wojespn",130,7361,517767,525128,image,FALSE
CompanyJ_2805,Dwight is ready for a fresh start,33,5232,333066,338298,image,FALSE
CompanyJ_2806,Hard to find a couple with more  than Megan Rapinoe and Sue Bird:  Pinoe: 2x World Cup 2012 Olympic Gold 2019 World Cup Golden Ball & Golden Boot 2012/13 Division 1 Feminine 2x NWSL Shield  Sue: 3x WNBA Champ 2x NCAA Champion 4x Olympic gold 4x World Champ,256,2931,267824,270755,carousel,FALSE
CompanyJ_2807,#NAME?,102,1097,317468,318565,carousel,FALSE
CompanyJ_2808,Vlad Jr.'s dad won the Home Run Derby in 2007.  Tonight Vlad Jr. set the record for most HRs in a single round with 29  (via @mlb),130,1129,294392,295521,carousel,FALSE
CompanyJ_2809,Jaxson Hayes caught a BODY  (via @nbatv),40,5810,506276,512086,video,FALSE
CompanyJ_2810,Emmitt Smith Jr. is following in his fathers footsteps  The Cowboys legend says hes been special since birth @brgridiron,120,604,115455,116059,video,FALSE
CompanyJ_2811,13 years ago today: Zidanes infamous headbutt in the World Cup final  (via @brfootball),87,1511,181128,182639,video,FALSE
CompanyJ_2812,"Boogie is returning to 15, his old Kings number. Bron returning to his Miami 6. Lakers throwing it back this year ",114,5141,600133,605274,image,FALSE
CompanyJ_2813,"James Harden working on his touch with Arsenal  (via @reissnelson, @mranthonyyarde)",83,1321,158958,160279,video,FALSE
CompanyJ_2814,"Nets GM Sean Marks says he found out KD was coming to Nets from his IG post, there was no official meeting until after that ",124,3039,488039,491078,image,FALSE
CompanyJ_2815,Mayweather is now 50-1 ,23,6327,558277,564604,video,FALSE
CompanyJ_2816,New look for @kingjames in year 17?,35,1936,312096,314032,image,FALSE
CompanyJ_2817,Wild All-Star weekend   AL wins their 7th straight All-Star Game  Trout pays respect to No. 45 Skaggs  Vlad's historic shots vs. Alonso's derby heroics  Celebrity love everywhere,178,757,160851,161608,carousel,FALSE
CompanyJ_2818,Take a charge from Tacko Fall at your own risk ,47,4231,454596,458827,video,FALSE
CompanyJ_2819,"9 years ago today, LeBron and Bosh joined Wade in Miami and the Heatles were born  (From @americanexpress x B/R)",112,923,137510,138433,video,FALSE
CompanyJ_2820,"Deal back home is official. 2K needs this, baybee.",50,4377,573283,577660,image,FALSE
CompanyJ_2821,2021 free agency market could be stacked  Kawhi Bron PG Giannis,63,5515,421155,426670,carousel,FALSE
CompanyJ_2822,Pinoes victory dance >>>,24,7320,382898,390218,video,FALSE
CompanyJ_2823,@ab turns 31 today as one of the greats. What a journey  @brgridiron,68,3620,402284,405904,carousel,FALSE
CompanyJ_2824,That was the whole field  @obj LAUNCHED this ball @brgridiron *NSFW* (via @jpqz),80,2260,347231,349491,video,FALSE
CompanyJ_2825,Tyler Herro has taken Summer League by storm  (Swipe  for his best plays),73,4754,461301,466055,carousel,FALSE
CompanyJ_2826,"This 11-year-old kid put the moves on Luke Kuechly...but Luke got him back  (via @4kcotto, h/t @brgridiron)",107,2019,253630,255649,video,FALSE
CompanyJ_2827,Windmill Bronny  (via @br_hoops),32,2384,329634,332018,video,FALSE
CompanyJ_2828,"On this day in 2014, @kingjames announced he was coming home to Cleveland ",74,1766,240818,242584,video,FALSE
CompanyJ_2829,Whatever it takes ,18,3360,479999,483359,image,FALSE
CompanyJ_2830,ADs game will prove to be worth the haul Lakers gave up to land the superstar,77,1694,191810,193504,video,FALSE
CompanyJ_2831, x  Royalty,11,5518,601343,606861,image,FALSE
CompanyJ_2832,"Wades daughter was fed up with videos, just wants Daddys phone  (via @dwyanewade)",81,1107,214462,215569,video,FALSE
CompanyJ_2833,"Three years ago today, Tim Duncan announced his retirement with a press release from the Spurs, which didnt even include any comments from the Big Fundamental.  A quiet end to an iconic career.",193,2467,394615,397082,image,FALSE
CompanyJ_2834, WNBA All-Star Captains: Elena Della Donne & A'ja Wilson  Starters: Liz Cambage Brittney Griner Natasha Howard Jonquel Jones Chelsea Gray Jewell Loyd Kayla McBride Kia Nurse,173,2622,106470,109092,image,FALSE
CompanyJ_2835,"Breaking: Thunder trade Russell Westbrook to Houston for Chris Paul and 2024, 2026 first-round picks, pick swaps in 2021 and 2025, per @wojespn",143,55332,1574671,1630003,image,FALSE
CompanyJ_2836,A look back at Russ and Harden in OKC  (via @nba),49,3208,490105,493313,carousel,FALSE
CompanyJ_2837,OKC was never the same after this...,36,7569,525770,533339,video,FALSE
CompanyJ_2838,Russ is now on the Rockets   One of the coldest dudes in the league  (@coorslight),82,1457,151293,152750,video,FALSE
CompanyJ_2839,End of an era in OKC.,21,5420,570127,575547,carousel,FALSE
CompanyJ_2840,OKC turned Russ and PG into... ,31,4868,378012,382880,image,FALSE
CompanyJ_2841,CP3 heads to OKC,16,12156,645519,657675,image,FALSE
