UI_ID,Caption,Character Count,Comments Count,Likes Count,Total Actions,Media Type,Includes Hashtag
CompanyJ_1374,"Earlier this week, @michaelirvin88 underwent tests for possible throat cancer. Today it came back that hes cancer-free ",119,4054,415785,419839,image,FALSE
CompanyJ_1375,DLo has proved himself ,23,3392,314297,317689,image,FALSE
CompanyJ_1376,TRAE YOUNG COLD-BLOODED   Two go-ahead buckets in the last six seconds,70,2154,236853,239007,video,FALSE
CompanyJ_1377,Brown was dancing on the three-point line ,42,244,125703,125947,video,FALSE
CompanyJ_1378,A first for Auburn ,19,994,187071,188065,image,FALSE
CompanyJ_1379,Okeke (ACL) left hospital to support Auburn in the 2nd half. They outscored Kentucky 47-36 to lock ticket to Final Four in OT.,126,421,138192,138613,video,FALSE
CompanyJ_1380,Zion looked bouncy in warmups,29,1455,196837,198292,video,FALSE
CompanyJ_1381,McQuaid making up moves mid-air ,32,521,127631,128152,video,FALSE
CompanyJ_1382,Sparty knocks Zion and Duke out of the tourney ,47,4642,249797,254439,video,FALSE
CompanyJ_1383,MSU escapes Duke after RJ Barrett's missed FT.  Another wild ending.,68,2838,298335,301173,video,FALSE
CompanyJ_1384,The Final Four is set. Who you got?,35,4107,200440,204547,image,FALSE
CompanyJ_1385,Michigan State to everyone who had Duke winning it all:,55,2003,232449,234452,video,FALSE
CompanyJ_1386,Ice Trae called game ,21,381,83968,84349,video,FALSE
CompanyJ_1387,Unforgettable season for Zion and RJ as they led Duke to ACC championship and Elite 8,85,2910,357053,359963,image,FALSE
CompanyJ_1388,Athletes offer their support and condolences to Nipsey and his family ,70,1190,227164,228354,video,FALSE
CompanyJ_1389,Nipsey was in Anaheim yesterday cheering on Texas Tech in the Elite 8. Prayers to him and his family  (via @jazzamari),118,2896,505644,508540,video,FALSE
CompanyJ_1390,Oracle Arena played Nipsey and the Warriors showed love  (via @loganmmurdock),77,1216,239993,241209,video,FALSE
CompanyJ_1391,Sean Taylor was one of a kind. The famed No. 21 would have been 36 today (via @thecheckdown),92,1832,291075,292907,carousel,FALSE
CompanyJ_1392,Nobody is safe. Nothing is guaranteed  #GameOfZones premieres 4/11 on the B/R App ,82,1339,202276,203615,video,FALSE
CompanyJ_1393,Seeing Kap back on the field  Joined by Saquon and Offset #HunchoDay,68,2887,287617,290504,video,FALSE
CompanyJ_1394,Zion's shoe deal is expected to be at least $100M. @brkicks,59,1570,213228,214798,image,FALSE
CompanyJ_1395,#NAME?,22,969,195635,196604,image,FALSE
CompanyJ_1396,The Pope puts the Messi hype in perspective  (via @brfootball),62,1357,143336,144693,image,FALSE
CompanyJ_1397,Last seasons ROY gives his vote ,32,2282,211695,213977,image,FALSE
CompanyJ_1398,Still one of the best April Fools Day jokes.  They told Shaq we ranked him ninth on the all-time centers list and he almost tore the set up  (Via @nbaontnt),156,2429,433984,436413,video,FALSE
CompanyJ_1399,KentuckyFOR LIFE  John Calipari has agreed to a lifetime deal that ensures he finishes career with the Wildcats,111,1880,295651,297531,image,FALSE
CompanyJ_1400,Kyrie saved it. Tatum dished it. Hayward finished it.,53,4029,770320,774349,video,FALSE
CompanyJ_1401,@kingjames dedicating todays workout to Nipsey  *NSFW*,54,1534,197417,198951,video,FALSE
CompanyJ_1402,Painted @TheRock with a dumbbell and it turned out unbelievable (via @bou_bou_design_),86,3033,263549,266582,video,FALSE
CompanyJ_1403,Kemba went off for 38 points in the second half ,48,1699,285832,287531,video,FALSE
CompanyJ_1404,LeBron will have a full-length court built on the set of 'Space Jam 2 to train while filming.  MJ did the same thing as he prepared for his second three-peat. (via @theathletichq),179,4627,476084,480711,image,FALSE
CompanyJ_1405,"Kawhi, D-Wade and Montrezl honored Nipsey  @brkicks",51,481,128293,128774,carousel,FALSE
CompanyJ_1406,New faces. Same drama. The Champions season 2 is coming soon  (via @brfootball),79,289,31825,32114,image,FALSE
CompanyJ_1407,Zion and RJ are the first freshman teammates to make the AP All-American first team since Boogie and Wall,105,1747,427768,429515,carousel,FALSE
CompanyJ_1408,"Oh really, @shaq? ",18,1329,193710,195039,image,FALSE
CompanyJ_1409,Nuggets Melo >>>,16,1898,281161,283059,image,FALSE
CompanyJ_1410,"Zion, RJ, Ja, Grant and Cassius ",32,2470,275521,277991,image,FALSE
CompanyJ_1411,"Kap, Gucci and other stars showed out at Quavos #HUNCHODay ",59,630,104632,105262,video,FALSE
CompanyJ_1412,Russ holding it down for Nipsey tonight  (via @okcthunder),58,1829,420120,421949,video,FALSE
CompanyJ_1413,Kuz helping Bron put his chain on. Real friends ,48,3038,368111,371149,video,FALSE
CompanyJ_1414,Russ is the 1st player since Wilt with a 20/20/20 game ,55,2989,481400,484389,video,FALSE
CompanyJ_1415,The Marathon Continues ,23,2057,258433,260490,image,FALSE
CompanyJ_1416,Bryce Harper with the nasty bat flip in his return to Washington  (Via @mlb),76,1399,177754,179153,video,FALSE
CompanyJ_1417,Yall better ride for me - Nipsey,32,791,208120,208911,image,FALSE
CompanyJ_1418,"Diva? Bully? Toxic? Philadelphia 76ers star @JimmyButler sets the record straight on his past behavior and opens up on why he almost quit playing basketball in college while playing a game of spades on the premiere of ""Take It There with @TaylorRooks."" ",253,591,127688,128279,video,FALSE
CompanyJ_1419,I suck?  (via alex_burness/TW),30,5801,639298,645099,video,FALSE
CompanyJ_1420,"Projected No. 2 pick @igotgame12_ will declare for the 2019 NBA draft today, per @shamsnba",90,1531,294988,296519,image,FALSE
CompanyJ_1421,Cole Anthony and Vernon Carey Jr. are taking over NYC as the top-ranked H.S. basketball teams play for a National Title. @br_hoops,130,277,68643,68920,video,FALSE
CompanyJ_1422,Time for a  fam reunion? Isaiah Washington and Jahvon Quinerly have both entered the CBB transfer portal. @br_hoops,115,1473,183859,185332,image,FALSE
CompanyJ_1423,First 20/20/20 since Wilt.  Russ did it real big last night in honor of Nipsey Hussle ,86,546,109401,109947,video,FALSE
CompanyJ_1424,"Steph Curry broke out of a recent sub-37% 3PT shooting slump by putting on contact lenses to fix eye issues hes had his whole career, per @thompsonscribe",153,5457,395229,400686,image,FALSE
CompanyJ_1425,Being far from home for the first time almost made @JimmyButler quit basketball forever at Marquette,100,256,51077,51333,video,FALSE
CompanyJ_1426,Russ goes 20-20-20 for Nipsey  #RIP,35,2683,347162,349845,video,FALSE
CompanyJ_1427,Trae Young hooping in the Ice Trae Adidas N3XT L3V3L  @brkicks,62,3992,441725,445717,carousel,FALSE
CompanyJ_1428,Kawhi was fed up,16,3321,305690,309011,video,FALSE
CompanyJ_1429,Beal has a new pregame routine after last night  (via @washwizards),67,895,212083,212978,video,FALSE
CompanyJ_1430,Reggie Jacksons step-back was filthy,36,2115,159147,161262,video,FALSE
CompanyJ_1431,Pop was ejected a minute into the game...,41,2044,198577,200621,video,FALSE
CompanyJ_1432,Kemba Walker went off for 21 of his 32 PTS in the 4Q to beat the the New Orleans Pelicans and kept the Charlotte Hornets' playoff hopes alive.,142,1033,263843,264876,video,FALSE
CompanyJ_1433,Wade and Kyrie have some of the best footwork of all-time,57,839,194245,195084,video,FALSE
CompanyJ_1434,Trae making his case for ROY,28,4588,325043,329631,image,FALSE
CompanyJ_1435,Aaron Rodgers hated Mike McCarthy from the moment he got hired.  And it only got worse from there.,98,2426,215866,218292,image,FALSE
CompanyJ_1436,"From Boogie stare downs to Giannis sky alleys, these guys took flight this season",81,609,185460,186069,video,FALSE
CompanyJ_1437,Greg Oden is finding redemption as an OSU student-coach after an injury-ridden career made him an NBA draft bust,112,1098,141885,142983,video,FALSE
CompanyJ_1438,Bench celebrations have taken over the NBA this year,52,843,145981,146824,video,FALSE
CompanyJ_1439,Embiid and Bledsoe are bringing the playoff intensity ,54,2936,231965,234901,video,FALSE
CompanyJ_1440,Greek Freak showed up and dominated. 45 PTS | 13 REB | 6 AST | 5 BLK,68,2228,356560,358788,video,FALSE
CompanyJ_1441,Steph can see clearly NOW,25,2233,252642,254875,video,FALSE
CompanyJ_1442,Greek Freak blocked Joel Embiid FOUR times tonight,50,6950,423293,430243,video,FALSE
CompanyJ_1443,Caruso got BOUNCE,17,2278,159378,161656,video,FALSE
CompanyJ_1444,Will Giannis finish the season with an MVP like Kareem did? ,60,2272,297131,299403,image,FALSE
CompanyJ_1445,Just two of the NBAs best players chatting ,43,4293,407590,411883,image,FALSE
CompanyJ_1446,"Last year, Donte DiVincenzo boosted his draft stock with a historic 31 points in the national championship.  Who will be this years hero?",137,313,62061,62374,video,FALSE
CompanyJ_1447,Jimmys face. D-Wades prayer. Harden to beat GSW.  Best buzzer-beaters from this season,86,1081,249987,251068,video,FALSE
CompanyJ_1448,#NAME?,99,380,63633,64013,carousel,FALSE
CompanyJ_1449,"Bulls guard Walt Lemon Jr. wears No. 25 because he grew up in Chicago idolizing D-Rose: ""I want to be just like that guy""  You can see the influence on his game.",161,4148,409124,413272,video,FALSE
CompanyJ_1450,The detail on this Kobe tattoo  (via @stevebutchertattoos),58,2835,367399,370234,image,FALSE
CompanyJ_1451,Kobe keeping it real ,21,4299,376313,380612,image,FALSE
CompanyJ_1452,Giannis is unstoppable ,23,6126,458570,464696,image,FALSE
CompanyJ_1453,Russ averages a triple-double for the 3rd straight season. Never done before in NBA history. #WhyNot,100,3794,429197,432991,image,TRUE
CompanyJ_1454,Air Dirk in year 21 ,20,978,161517,162495,video,FALSE
CompanyJ_1455,"Dame is rocking Game of Zones-inspired 5s tonight called ""Dame of Zones"" vs. the Nuggets ",89,439,116757,117196,carousel,FALSE
CompanyJ_1456,JEREMY LAMB BEATS THE RAPTORS AGAIN,35,5277,483425,488702,video,FALSE
CompanyJ_1457,"Goodness, Russ ",15,5981,549553,555534,video,FALSE
CompanyJ_1458,Jake Bauers rode up to his at bat bumping that @lilnasx  (via @mlbcut4),71,1110,140869,141979,video,FALSE
CompanyJ_1459,D-Wade or Pierce?,17,14503,382249,396752,image,FALSE
CompanyJ_1460,DLo left a photo shoot to do this ,34,7962,807024,814986,video,FALSE
CompanyJ_1461,@russwest44 is writing history this season  First player ever to average 3 straight seasons with a triple-double  First 20/20/20 game since Wilt  Held longest-ever streak with a triple-double (11 games)  Why not?,212,2510,315423,317933,image,FALSE
CompanyJ_1462,"At its first Final Four in 35 years, Virginia is ready to rewrite its March Madness legacy",90,274,64592,64866,video,FALSE
CompanyJ_1463,Imagine going one-on-one against...an elephant  (via @rene_casselly),68,4279,296828,301107,video,FALSE
CompanyJ_1464,The Final Four is here!,23,281,53461,53742,video,FALSE
CompanyJ_1465,Zaire not tolerating any disrespect to his dads legacy.,55,10213,644350,654563,image,FALSE
CompanyJ_1466,GET THAT OUTTA HERE ,20,198,40576,40774,video,FALSE
CompanyJ_1467,Virginia is headed to the National Championship!,48,3437,223259,226696,image,FALSE
CompanyJ_1468,Did the ref miss a double-dribble call at the end of Virginia-Auburn? ,70,8632,343175,351807,video,FALSE
CompanyJ_1469,Paul Pierce looking at the TL debate between he and D-Wade..,60,3834,181192,185026,video,FALSE
CompanyJ_1470,March Madness comes at you fast...,34,4042,524604,528646,image,FALSE
CompanyJ_1471,OH MY.,6,477,146061,146538,video,FALSE
CompanyJ_1472,Texas Tech is headed to the National Championship!,50,1289,301721,303010,image,FALSE
CompanyJ_1473,CULVER. DAGGER.,15,570,113187,113757,video,FALSE
CompanyJ_1474,The National Championship is Set ,33,1921,247950,249871,image,FALSE
CompanyJ_1475,Texas Tech got hot and Pat Mahomes was hype ,44,296,109853,110149,video,FALSE
CompanyJ_1476,Sabrina has unfinished business ,32,2865,196801,199666,image,FALSE
CompanyJ_1477,Zion wins Naismith Player of the Year. KD and AD were the only other freshman to do it.,87,2145,496989,499134,image,FALSE
CompanyJ_1478,Ronda Rouseys been making history all her life   UFC barrier-breaker. All-time dominant athlete. First woman to headline WrestleMania.,134,393,28294,28687,video,FALSE
CompanyJ_1479,Legendary company. @brkicks,27,3090,420949,424039,image,FALSE
CompanyJ_1480,Kevin Love checked in wearing Channing Frye's college jersey  (via @nba),72,785,234159,234944,video,FALSE
CompanyJ_1481,AB and JuJu at odds ,20,6679,290043,296722,image,FALSE
CompanyJ_1482,Ryan Shazier continues to amaze  (via @shazier),47,952,111816,112768,video,FALSE
CompanyJ_1483,RJ not feeling what the Warriors did in 2016.,45,14643,512174,526817,image,FALSE
CompanyJ_1484,The Nets clinch their first playoff appearance since 2014-2015.,63,3887,493801,497688,image,FALSE
CompanyJ_1485,We Believe Warriors jerseys for the last regular season game at Oracle Arena ,77,1691,212406,214097,video,FALSE
CompanyJ_1486,From rookie season  last regular season game at Oracle Arena. We Believe forever.,81,1751,412542,414293,image,FALSE
CompanyJ_1487,Kofi Kingston FINALLY wins the belt! #wrestlemania,50,2416,259759,262175,image,FALSE
CompanyJ_1488,"Stephen Curry finished with 27 PTS, 6 REB and 4 AST in the Warriors' last regular season game at Oracle Arena",109,1411,366727,368138,video,FALSE
CompanyJ_1489,What a week ,12,3216,287420,290636,image,FALSE
CompanyJ_1490,Hezonja denies Bron and the Lakers at MSG. D-Rose humbles Luka. Okogie clamps Hardens step-back.  Best blocks from this season,126,548,105247,105795,video,FALSE
CompanyJ_1491,Antonio Brown just put up a 2015 DM from JuJu asking for advice while at USC,76,11754,330912,342666,image,FALSE
CompanyJ_1492,"On this day in 2003, a high school phenom shook hands with his idol after Cavs/Wizards.  He later described meeting him as like Black Jesus walking towards me.",159,1876,397151,399027,image,FALSE
CompanyJ_1493,Rakitics rocket. Ronaldos volley. Messis free-kick. The Champions League has had some unreal goals so far  (via @brfootball),124,277,40273,40550,video,FALSE
CompanyJ_1494,"Seven years ago today, Melo hit two of the most cold-blooded shots of his career (via @nbahistory)",98,9722,559467,569189,video,FALSE
CompanyJ_1495,Kyle Korver says we must strive for better ,43,3622,366600,370222,image,FALSE
CompanyJ_1496,What a tourney its been so far ,31,267,63109,63376,video,FALSE
CompanyJ_1497,Salute ,7,3104,528939,532043,image,FALSE
CompanyJ_1498,"D-Roses agent says hed be open to returning to the Bulls this summer: Theres no doubt that in his heart, Chicago will always be there (via @670thescore)",152,3472,458913,462385,image,FALSE
CompanyJ_1499,Virginia wins its first title in mens program history ,54,4202,370494,374696,image,FALSE
CompanyJ_1500,CELEBRATION TIME FOR UVA ,25,637,94646,95283,video,FALSE
CompanyJ_1501,Kyle Guy wins Most Outstanding Player of the Final Four,55,2711,332422,335133,image,FALSE
CompanyJ_1502,What a difference a year makes...,33,1162,297783,298945,image,FALSE
CompanyJ_1503,Its that time  One Shining Moment to close out #MarchMadness,60,635,152116,152751,carousel,FALSE
CompanyJ_1504,Virginia DENIED Texas Techs hopes for a title in OT ,52,399,80541,80940,video,FALSE
CompanyJ_1505,D-Wades last regular-season game in Miami tonight. #OneLastDance,64,4776,567264,572040,image,FALSE
CompanyJ_1506,Eight teams left. The Champions League is BACK  Follow @brfootball for the best from the quarterfinals & more,109,609,78405,79014,image,FALSE
CompanyJ_1507,Giannis doesnt need the bright lights.,38,6859,461454,468313,image,FALSE
CompanyJ_1508,D-Wade to Bron off glass. Trae turning defenders around.  Russ getting fancy on the break.  Best assists of the year.,117,352,78557,78909,video,FALSE
CompanyJ_1509,You can grab a limited edition @dwyanewade jersey or bomber and more NOW. link in bio. . @josh.sobel,100,712,116685,117397,carousel,FALSE
CompanyJ_1510,WHAT A WINNER FROM SON  (via @brfootball),41,626,54950,55576,video,FALSE
CompanyJ_1511,D-Wade arrives in an all-red suit for his last regular season game in Miami  (Via @nba),87,1051,166682,167733,video,FALSE
CompanyJ_1512,One Last Dance.  @Brkicks,25,1007,301524,302531,carousel,FALSE
CompanyJ_1513,Steph is one of a kind.,23,1853,318729,320582,image,FALSE
CompanyJ_1514,"We took over the student section for Texas Tech, but @Master_Tesfatsion's energy wasn't enough for the Red Raiders to topple Virginia",133,262,113062,113324,video,FALSE
CompanyJ_1515,Congrats on retirement @dwyanewade #OneLastDance,48,3198,811056,814254,image,FALSE
CompanyJ_1516,"What a moment. Zaire Wade recreates D-Wades famous From Robbins, Illinois commercial ",85,979,194882,195861,video,FALSE
CompanyJ_1517,Whos cutting onions? ,21,1455,289868,291323,image,FALSE
CompanyJ_1518,Dirk is EATING. He scored the first 10 points for the Mavs ,59,605,140613,141218,video,FALSE
CompanyJ_1519,Breaking: Magic Johnson has stepped down from President of Basketball Ops of the Lakers,87,16426,557600,574026,image,FALSE
CompanyJ_1520,Im the president now.,21,7747,613805,621552,image,FALSE
CompanyJ_1521,The Magic Era is over.,22,4397,356241,360638,image,FALSE
CompanyJ_1522,"Most disappointing Lakers season ever? - Magic quit - AD trade fiasco - LeBron got hurt - Lonzo got hurt - Missed playoffs - Clippers made playoffs - D-Lo, Randle, Brook balling - Two more wins than last year",208,8254,516354,524608,image,FALSE
CompanyJ_1523,Magic walking into Staples Center...,36,743,91121,91864,video,FALSE
CompanyJ_1524,"Heat fans really started a ""Paul Pierce sucks"" chant in Dwyane Wade's last home game",84,5246,526474,531720,video,FALSE
CompanyJ_1525,Oh no. D-Wade tripped trying to jump on the scorers table after the game ,73,4876,608681,613557,video,FALSE
CompanyJ_1526,D-Wade dropped 30 in his last regular season game in Miami. Legend.,67,2493,443085,445578,video,FALSE
CompanyJ_1527,Dirk with his first 30 point performance since 2016.  Legend.,61,1056,322204,323260,image,FALSE
CompanyJ_1528,Dirk announces he is officially retiring ,41,5189,659132,664321,image,FALSE
CompanyJ_1529,What a career for Dirk Nowitzki,31,2074,380034,382108,video,FALSE
CompanyJ_1530,Crawford almost stole the show in Dirks final home game,55,1724,384510,386234,image,FALSE
CompanyJ_1531,PG FOR THE WIN.,15,2972,267857,270829,video,FALSE
CompanyJ_1532,Dirk and D-Wade put on one last show for their home crowds,58,2716,550990,553706,image,FALSE
CompanyJ_1533,Harden became the 5th player in NBA history to average 35+ PPG in a season last night,85,2692,351813,354505,image,FALSE
CompanyJ_1534,"Last night  Magic steps down as Lakers president  D-Wade drops 30 in final home game  Dirk announces retirement, also drops 30  Jamal Crawford becomes oldest player to drop 50 points  Paul George game-winner  Lakers lose at the buzzer",234,1855,431562,433417,image,FALSE
CompanyJ_1535,Its fresh faces vs. past champions at this years Masters ,57,67,13357,13424,video,FALSE
CompanyJ_1536,Blazers superstar @damianlillard explains that he can live with no rings as long as he remains true to himself on the latest episode of Take It There with Taylor Rooks. The best rapper in the NBA also explains what makes a rapper corny and drops some new bars ,260,550,112451,113001,video,FALSE
CompanyJ_1537,One of the best parts of #OneLastDance? All the jersey swaps ,61,333,130372,130705,video,FALSE
CompanyJ_1538,The stats speak for themselves.  Dirk goes out as one of the best ever,70,1040,102377,103417,video,FALSE
CompanyJ_1539,JRs secret stuff   Space Jam 2 trailer gets the NBA2K remix (via @shady00018_),78,1306,144999,146305,video,FALSE
CompanyJ_1540,D-Wade knew ,12,315,97334,97649,video,FALSE
CompanyJ_1541,Ronaldo FLYING HEADER to give Juventus the lead  (via @brfootball),66,837,74069,74906,video,FALSE
CompanyJ_1542,Messi with a bloody nose and eye after a collision with Smalling (via @brfootball),82,1292,97549,98841,video,FALSE
CompanyJ_1543,3 #OneLastDance,15,669,323020,323689,image,FALSE
CompanyJ_1544,The Las Vegas Aces have selected Jackie Young with the No. 1 pick in the #WNBADraft  2018-2019:  14.3 PTS | 7.0 REB | 5.2 AST,125,2971,166878,169849,image,FALSE
CompanyJ_1545,Farewell Swish ,15,698,226551,227249,image,FALSE
CompanyJ_1546,The Banana Boat crew pulled up to support D-Wade in his last game  (via @nbatv),79,677,172360,173037,video,FALSE
CompanyJ_1547,D-Wade fans gotta be exhausted ,31,644,151034,151678,video,FALSE
CompanyJ_1548,No. 4 pick @katielou33s favorite player is Larry Bird. Bird surprised her with a special message right after she got drafted  (via @WNBA),137,455,61312,61767,video,FALSE
CompanyJ_1549,D-WADE WITH THE TRIPLE-DOUBLE IN HIS LAST GAME. The banana boat crew loves it ,78,3187,615242,618429,video,FALSE
CompanyJ_1550,"Fans are chanting ""Paul Pierce sucks"" during D-Wade's final game...this time in Brooklyn ",89,1769,185719,187488,video,FALSE
CompanyJ_1551,Bron had to video-bomb Wade one last time ,42,2953,554117,557070,video,FALSE
CompanyJ_1552,"Another historic season for Russ   Westbrook notched his 138th triple-double to end the regular season, tying Magic Johnson for second all-time",143,1683,334894,336577,image,FALSE
CompanyJ_1553,Cheers to 16 years  #OneLastDance,33,2171,629324,631495,image,FALSE
CompanyJ_1554,Your NBA stat leaders ,22,1544,220301,221845,image,FALSE
CompanyJ_1555,Luka becomes the 5th rookie ever to join the 20-5-5 club,56,2537,451171,453708,image,FALSE
CompanyJ_1556,Giannis keeps on building his MVP resume,40,3756,437434,441190,image,FALSE
CompanyJ_1557,This season   Jimmy vs. Wolves  Luka/Trae  KD/Dray fight  Rondo punched CP  D-Rose comeback  AD saga  KP trade  D-Lo breakout  BBB chaos  Bron/Kyrie made up  Russ triple-double  Harden highest PPG since MJ  Magic quit  Dirk/Wade retired  MVP race,246,2369,446836,449205,carousel,FALSE
CompanyJ_1558,These kids were so excited to be next to Ronaldo  (via @brfootball),67,2165,243609,245774,video,FALSE
CompanyJ_1559,"From Boogies tossed shoe to Pops ejection in 63 seconds, techs were truly wild this year ",89,514,121700,122214,video,FALSE
CompanyJ_1560,"GAME OF ZONES SEASON 6 PREMIERE  Watch exclusively in the B/R App. The Jimmy Butler, T-Wolves practice footage is finally revealed ",131,373,43692,44065,video,FALSE
CompanyJ_1561,Wade bringing in his retirement with his brother Melo ,54,3485,374193,377678,video,FALSE
CompanyJ_1562,The NBA might have a new block king and his name is Jarrett Allen ,66,1918,155297,157215,video,FALSE
CompanyJ_1563,Giannis is the basketball dream ,32,9672,898599,908271,carousel,FALSE
CompanyJ_1564,GAME OF ZONES SEASON 6 PREMIERE! Jimmy Butler turned the T-Wolves practice into a bloodbath #GameOfZones  (@StateFarm),118,1331,184726,186057,video,FALSE
CompanyJ_1565,"The inaugural class of students at LeBrons @ipromiseschool have posted extraordinary results so far  90 percent met or exceeded growth goals in reading and math, per @nytimes",174,2625,343602,346227,image,FALSE
CompanyJ_1566,"Six years ago today, Kobe tore his Achilles, then limped to the line and knocked down two free throws.  Mamba was different",123,7003,686798,693801,image,FALSE
CompanyJ_1567,"Kyrie, CP3, DeAndre and others around the league are shifting toward plant-based diets.  Its working ",101,2381,175837,178218,video,FALSE
CompanyJ_1568,Whole series of Russ vs. Dame should be fun ,44,10454,519264,529718,video,FALSE
CompanyJ_1569,"BREAKING: Lakers, Luke Walton mutually agree to part ways, per @shamsnba",72,5621,399450,405071,image,FALSE
CompanyJ_1570,"Ty Lue is a strong frontrunner for the Lakers job, per @wojespn",63,6290,431647,437937,image,FALSE
CompanyJ_1571,Chicago native @jabariparker and @shothechi star Jacob Latimore surprise deserving students with some heat on a new episode of Sneaker Shock . Their reactions were perfect (via @brkicks),186,85,21369,21454,video,FALSE
CompanyJ_1572,Anything is possible in LA  B/R x @beatsbydre,45,462,54520,54982,video,FALSE
CompanyJ_1573,The Ball brothers are feeling Billie Ray Cyrus on Lil Nas X Old Town Road,73,6663,337419,344082,video,FALSE
CompanyJ_1574,Zion Williamson and Sabrina Ionescu win the Wooden Award for most outstanding player in college hoops ,102,1797,382527,384324,image,FALSE
CompanyJ_1575, NBA PLAYOFFS ARE HERE ,23,4150,238216,242366,video,FALSE
CompanyJ_1576,The Endgame in the East begins today...,39,4026,472897,476923,image,FALSE
CompanyJ_1577,Three years ago today: Warriors 73rd win (most all-time) and Kobes epic 60-point finale. One of the wildest basketball days ever.,129,1984,360547,362531,image,FALSE
CompanyJ_1578,D-Lo and Nets have come a long way,34,1402,242908,244310,video,FALSE
CompanyJ_1579,Alvin Kamara is a machine (via @doctor_reef),44,3658,313226,316884,video,FALSE
CompanyJ_1580,KD believes it was all worth it ,32,7801,399299,407100,image,FALSE
CompanyJ_1581,"Luke Walton agrees to terms with Kings to become next head coach, per @sramick",78,4102,351965,356067,image,FALSE
CompanyJ_1582,D-Lo and the Nets steal Game 1 in Philly,40,5642,633616,639258,image,FALSE
CompanyJ_1583,Amir Johnson and Embiid pulled out a phone on the bench during the game,71,2357,156652,159009,video,FALSE
CompanyJ_1584,Sixers fans let Ben Simmons hear the boos at the free throw line.  He finished with just 9 PTS.,95,5554,318789,324343,video,FALSE
CompanyJ_1585,"Embiid says Amir Johnson was using his phone during the game to check on his daughter who is ""extremely sick.",109,4339,478214,482553,carousel,FALSE
CompanyJ_1586,Will anyone knock the Warriors off the Western throne?,54,3009,320703,323712,image,FALSE
CompanyJ_1587,Simmons has a message for Sixers fans,37,8736,401034,409770,image,FALSE
CompanyJ_1588,D.J. AUGUSTIN CALLED GAME  MAGIC LEAD RAPTORS 1-0,49,4123,294504,298627,video,FALSE
CompanyJ_1589,Lowry finished with 0 points on 0-7 shooting in 33 minutes ,59,5179,393914,399093,image,FALSE
CompanyJ_1590,Steph just passed Ray Allen for most made threes in playoff history with 386  A lot of splashes for Curry ,106,1901,325467,327368,image,FALSE
CompanyJ_1591,Steph was unguardable against the Clippers   38 PTS | 15 REB | 7 AST,68,1518,153948,155466,video,FALSE
CompanyJ_1592,Playoff intensity ,18,3250,476980,480230,image,FALSE
